survey_name,Q1,Q2,Q3,Q4,Q5
personal,55,Fort Worth,Technology,Extremely satisfied,Gravida ab sed ridiculus. Lorem montes mi. Velit aliquam lorem tortor.
personal,39,Austin,Energy,Somewhat satisfied,"Auctor! In convallis, potenti! Vitae proin tempor vehicula non nunc consectetuer."
personal,75,Houston,Technology,Extremely dissatisfied,Sagittis aenean. Dolorem faucibus rhoncus. Suscipit tempus facilisi neque eu fringilla.
personal,20,Austin,Healthcare,Extremely satisfied,Orci magna sagittis viverra suspendisse pellentesque ipsum magna! Suscipit porttitor.
personal,74,Fort Worth,Technology,Somewhat satisfied,"Nulla? Ac per maecenas vehicula et culpa turpis vulputate, curabitur! Vestibulum."
personal,67,Austin,Consulting,Extremely dissatisfied,"Cras sagittis? Vestibulum, fusce purus! Sapien pellentesque! Quam. Magnis magna."
personal,52,Houston,Energy,Extremely satisfied,Convallis. Per sodales. Consectetuer. Consectetuer diam justo turpis tincidunt erat.
personal,31,San Antonio,Technology,Somewhat satisfied,Urna sagittis! Viverra iaculis imperdiet a. Elit porta magna non fusce platea interdum eu.
personal,56,Dallas,Healthcare,Extremely satisfied,Vitae dui fringilla culpa etiam molestie rutrum? Dictumst sagittis. Pellentesque.
personal,43,San Antonio,Government Services,Neither satisfied nor dissatisfied,"Egestas! Ullamcorper orci temporibus. Tincidunt diam. In, commodo id fermentum. Vehicula. Maecenas tempus elit."
personal,80,Fort Worth,Healthcare,Somewhat dissatisfied,Integer ab ridiculus at felis nibh dolorem vitae. Morbi nonummy.
personal,39,Austin,Energy,Neither satisfied nor dissatisfied,"Magnis et. Justo proin rhoncus! Sagittis, lectus praesent turpis atque vestibulum."
personal,68,Dallas,Consulting,Somewhat dissatisfied,Culpa velit rutrum dui? Integer nonummy magna magnis? Dolorem interdum. Nulla lorem mauris nec. Accusamus.
personal,39,Austin,Energy,Neither satisfied nor dissatisfied,"Odio quis massa. Imperdiet? Cursus ultricies, mauris natoque curabitur quam. Montes nec."
personal,45,Austin,Consulting,Somewhat satisfied,Donec interdum magnis elementum maecenas amet sollicitudin aenean natoque. Pretium.
personal,29,San Antonio,Healthcare,Somewhat dissatisfied,"Tellus leo porta dolorem tincidunt temporibus pharetra mattis arcu malesuada culpa turpis, mi."
personal,53,Fort Worth,Energy,Somewhat dissatisfied,Aenean. Rutrum fusce dolorem scelerisque duis enim mi dolor euismod porta per quis non maecenas.
personal,57,Dallas,Consulting,Somewhat dissatisfied,Montes laoreet at iaculis lorem non. Turpis? Lorem facilisis tempora id faucibus interdum.
personal,35,Houston,Healthcare,Somewhat satisfied,Erat ultrices cras? Auctor suspendisse temporibus vehicula wisi amet risus ullamcorper.
personal,87,Austin,Energy,Neither satisfied nor dissatisfied,Vulputate? Commodo. Neque diam pellentesque et leo pharetra ligula iaculis cras sem massa magna.
personal,73,San Antonio,Government Services,Somewhat dissatisfied,Id etiam fermentum culpa porttitor etiam morbi odio justo? Est! Donec ante amet.
personal,39,Houston,Government Services,Somewhat satisfied,Quis nibh! In integer convallis? Etiam! Laoreet pede atque pretium porta fermentum potenti porttitor dignissim.
personal,89,Houston,Consulting,Somewhat dissatisfied,Primis justo sem. Odio ullamcorper! Dapibus amet vivamus imperdiet nulla quam tempora.
personal,92,Houston,Technology,Extremely satisfied,Sed integer tempor ullamcorper integer eu interdum fusce vitae a faucibus magna? Rutrum.
personal,81,Houston,Technology,Extremely dissatisfied,Metus sagittis fringilla! Gravida nullam vulputate tempor aenean? Aenean? Metus ridiculus a massa.
personal,75,San Antonio,Government Services,Extremely satisfied,Platea ipsum! Auctor neque donec fermentum. Malesuada. Viverra. Molestie primis pede.
personal,84,Fort Worth,Government Services,Somewhat dissatisfied,Vitae praesent bibendum eget viverra consequat donec tortor sollicitudin commodo pellentesque magnis arcu dictumst.
personal,25,San Antonio,Government Services,Neither satisfied nor dissatisfied,Ut lectus est metus praesent risus nonummy leo placerat morbi vel. Luctus natoque.
personal,99,Dallas,Technology,Extremely dissatisfied,Eget consequat. Egestas donec dui proin euismod. Enim turpis maecenas vitae aenean fusce.
personal,53,Fort Worth,Technology,Extremely satisfied,"Culpa suscipit dolorem turpis neque, auctor dapibus atque bibendum volutpat cras! Magnis dictumst cursus tempora."
personal,69,Dallas,Healthcare,Extremely satisfied,Velit pretium fusce pellentesque odio dignissim commodo facilisi? Maecenas tempor arcu.
personal,69,San Antonio,Consulting,Extremely satisfied,Aliquet risus fringilla iaculis cursus nonummy malesuada ante ante lacus mattis a? Duis pellentesque praesent.
personal,18,Dallas,Energy,Somewhat dissatisfied,Metus! Tincidunt. Dapibus ullamcorper augue fusce aliquam enim euismod dictumst facilisis dolor.
personal,68,San Antonio,Government Services,Somewhat satisfied,"Curabitur? Blandit! Justo donec! Consequat accusamus turpis egestas. Euismod per malesuada egestas, fringilla ante."
personal,40,Austin,Consulting,Extremely dissatisfied,"Non ac? Augue nunc nec duis, vehicula elit a egestas facilisi imperdiet neque sit."
personal,93,San Antonio,Government Services,Somewhat satisfied,Erat neque? Scelerisque nulla justo! Mauris! Vel! At sodales phasellus imperdiet lacus montes proin.
personal,39,Houston,Healthcare,Neither satisfied nor dissatisfied,Etiam? Diam eget est placerat volutpat bibendum ultricies ipsum laoreet! Atque.
personal,79,Houston,Technology,Extremely dissatisfied,Non. Pellentesque wisi nullam euismod facilisi mattis vitae? Ultricies! Ab? Scelerisque? Molestie gravida dictumst.
personal,76,Austin,Consulting,Extremely satisfied,Dictumst temporibus nullam. Luctus tortor vitae tincidunt velit. Pede etiam vel montes eget.
personal,99,Houston,Energy,Extremely satisfied,"Tempus eros primis cursus blandit justo enim donec per? Orci maecenas bibendum, ultrices."
personal,49,Dallas,Government Services,Somewhat satisfied,"Wisi eget nulla, aliquet etiam sodales cursus consequat aliquet pharetra felis."
personal,23,Austin,Technology,Extremely satisfied,Accusamus. Consectetuer quis wisi vulputate interdum proin convallis pellentesque tortor.
personal,31,Fort Worth,Government Services,Somewhat dissatisfied,"Metus metus sodales. Platea enim lectus mi, arcu, consequat nibh cras posuere facilisis blandit! Eget."
personal,73,Fort Worth,Energy,Extremely dissatisfied,A? Sem justo turpis phasellus ac temporibus consectetuer blandit morbi temporibus facilisis amet.
personal,29,Dallas,Healthcare,Neither satisfied nor dissatisfied,Mattis auctor turpis! Vulputate rhoncus augue sem pretium praesent. Facilisis turpis elit.
personal,77,Fort Worth,Government Services,Somewhat satisfied,Potenti etiam augue etiam purus natoque felis. Aliquet nullam volutpat morbi odio.
personal,98,Houston,Energy,Somewhat dissatisfied,"Scelerisque viverra. Porta aenean bibendum, velit! Ultricies fusce porta molestie odio elit."
personal,93,Houston,Energy,Extremely dissatisfied,Euismod tortor cras molestie etiam pellentesque pharetra. Vitae mi! Accumsan augue rutrum imperdiet vulputate.
personal,95,Austin,Energy,Neither satisfied nor dissatisfied,Eleifend? Per molestie dignissim! Sagittis! Ridiculus lacus integer! Vulputate nec sapien rhoncus.
personal,64,Houston,Consulting,Somewhat dissatisfied,Accumsan magna vestibulum porta pellentesque proin! Suscipit? Rhoncus? Vel nec porttitor.
personal,19,Fort Worth,Energy,Neither satisfied nor dissatisfied,Ligula consectetuer rhoncus mi ut! Pede sed euismod ab. Sem.
personal,87,Houston,Consulting,Somewhat dissatisfied,Porta sagittis diam justo? Magnis aliquam mi duis vivamus metus. Ridiculus dui.
personal,72,Austin,Government Services,Somewhat dissatisfied,Tincidunt volutpat fermentum augue urna neque in justo! Cras tempus vulputate euismod magnis nunc ultricies.
personal,29,Dallas,Consulting,Extremely satisfied,"Montes ligula non, cras consequat. Velit porttitor massa! Porta massa aliquet vitae."
personal,45,San Antonio,Energy,Neither satisfied nor dissatisfied,"Suspendisse, vel ac accusamus faucibus posuere. Blandit egestas eleifend. Blandit? Vehicula dolor."
personal,46,Fort Worth,Energy,Neither satisfied nor dissatisfied,Iaculis! Praesent nunc turpis? Integer ante! Phasellus suspendisse massa euismod interdum imperdiet. Sagittis.
personal,21,Austin,Energy,Somewhat satisfied,Facilisis auctor amet massa cursus non metus. Quis dapibus primis.
personal,47,Houston,Energy,Somewhat dissatisfied,Imperdiet potenti sapien. Purus temporibus at justo mauris faucibus? Dictumst natoque nec egestas.
personal,68,Dallas,Technology,Neither satisfied nor dissatisfied,Curabitur nunc. Felis mattis commodo nonummy dapibus posuere purus! Convallis luctus facilisis? Non? Ullamcorper volutpat.
personal,87,Houston,Government Services,Neither satisfied nor dissatisfied,"Tincidunt sed, faucibus cursus eleifend nulla rutrum. Sed faucibus, primis dui porttitor. Curabitur nunc dolorem."
personal,66,Austin,Energy,Extremely satisfied,Lectus culpa dictumst ridiculus. Cras eu. Fermentum consequat felis? Ab! Vehicula fermentum metus quis sapien.
personal,52,San Antonio,Consulting,Extremely dissatisfied,"Scelerisque, laoreet, pharetra donec! Massa tempus. Elementum placerat. Natoque ab eleifend cursus. Tellus at in."
personal,73,San Antonio,Energy,Neither satisfied nor dissatisfied,Morbi ipsum mattis platea accusamus magnis odio? Neque sapien justo.
personal,62,Austin,Healthcare,Extremely dissatisfied,"Viverra sollicitudin? Per donec. Id! Viverra volutpat mauris elementum per per imperdiet porta, lectus."
personal,38,Fort Worth,Energy,Somewhat satisfied,Eget per blandit tellus erat lorem porta quam erat massa fermentum sollicitudin! A ridiculus.
personal,50,Dallas,Technology,Extremely dissatisfied,"Curabitur vivamus lorem duis consectetuer rutrum euismod commodo wisi consequat, atque. Dui rhoncus."
personal,32,Dallas,Government Services,Extremely dissatisfied,"Curabitur etiam cras maecenas bibendum! Neque vitae integer, sagittis! Velit, suspendisse pellentesque."
personal,96,Dallas,Energy,Extremely dissatisfied,"Ac urna fermentum euismod, ipsum ullamcorper sed? Proin aliquet vulputate culpa montes wisi. Consequat."
personal,29,Dallas,Consulting,Extremely satisfied,Convallis facilisi integer id egestas quam. Urna mauris est molestie.
personal,78,Austin,Healthcare,Neither satisfied nor dissatisfied,"Dictumst? Diam leo maecenas eros natoque faucibus lorem, odio faucibus est facilisi."
personal,37,Houston,Technology,Somewhat satisfied,Nulla volutpat vel consequat elementum. Id tempus et rhoncus urna posuere vivamus vivamus.
personal,53,San Antonio,Healthcare,Neither satisfied nor dissatisfied,"Turpis augue at integer atque aenean erat, sed ab vivamus vehicula."
personal,97,Dallas,Healthcare,Extremely dissatisfied,Integer elementum. Maecenas laoreet. Ultrices primis metus tempora ultrices commodo.
personal,41,San Antonio,Technology,Extremely satisfied,Rhoncus! Pellentesque vitae! Atque luctus quis ultricies mi suscipit venenatis vitae id.
personal,29,Austin,Technology,Somewhat satisfied,In erat vulputate sollicitudin in eu ridiculus neque elit rutrum atque.
personal,58,Fort Worth,Technology,Extremely dissatisfied,"Aliquet. Suspendisse vitae, in tincidunt, molestie mattis! Porta. Vel erat blandit."
personal,84,Dallas,Technology,Somewhat dissatisfied,"Faucibus eros nullam. Metus! Vestibulum lorem ridiculus morbi mi nonummy, aliquet neque natoque."
personal,57,Austin,Consulting,Neither satisfied nor dissatisfied,Accusamus pellentesque bibendum. Ac tincidunt volutpat atque dolor orci donec ac nonummy.
personal,22,San Antonio,Energy,Extremely dissatisfied,Quam phasellus lorem sem est sapien dolor amet ligula accusamus viverra faucibus.
personal,82,Dallas,Technology,Neither satisfied nor dissatisfied,"Eu nullam. Duis? At ultricies convallis, ipsum felis nibh elit."
personal,57,Fort Worth,Energy,Extremely dissatisfied,Ipsum nulla ultrices sed purus dolor non morbi lorem eleifend etiam. Convallis.
personal,49,Austin,Government Services,Neither satisfied nor dissatisfied,Egestas vulputate porta! Blandit venenatis risus curabitur imperdiet tempora leo augue dapibus temporibus.
personal,98,Houston,Government Services,Somewhat satisfied,"Vitae sodales. Euismod ullamcorper nulla egestas risus eu ligula, ante? Gravida tempus."
personal,22,Dallas,Government Services,Extremely satisfied,Fusce tempus imperdiet nullam. Aliquet ipsum sit at ultrices mattis. Tempor.
personal,31,Fort Worth,Consulting,Somewhat dissatisfied,Viverra commodo auctor gravida laoreet dui nulla scelerisque ullamcorper culpa.
personal,19,Austin,Energy,Somewhat satisfied,"Molestie platea primis praesent enim aliquam dolorem ligula. Temporibus, accumsan metus gravida aliquet magnis pellentesque."
personal,20,Fort Worth,Technology,Somewhat dissatisfied,"Consectetuer viverra ullamcorper aliquam purus ligula rhoncus, molestie ac turpis."
personal,31,Houston,Technology,Somewhat dissatisfied,Faucibus ullamcorper blandit consectetuer? Suspendisse ullamcorper interdum! Convallis. Tellus vulputate dui justo per ultricies temporibus.
personal,39,San Antonio,Government Services,Extremely satisfied,Dignissim pellentesque dictumst nonummy porttitor fusce nulla etiam lectus justo non placerat? Imperdiet. Eu.
personal,100,Dallas,Consulting,Extremely dissatisfied,Imperdiet vehicula curabitur. Nonummy neque. Lacus. A odio eget. Blandit. Felis.
personal,29,San Antonio,Energy,Extremely dissatisfied,Commodo aliquet! Tempor phasellus fermentum sem et nunc consectetuer. Ante nonummy! Ab ut.
personal,93,Houston,Technology,Somewhat satisfied,"Eget, felis amet est eros, maecenas viverra consequat! Orci dapibus convallis? Interdum ridiculus tempora."
personal,77,Dallas,Government Services,Neither satisfied nor dissatisfied,"Mattis dignissim consectetuer! Mattis fringilla posuere, integer tempus dolor maecenas duis."
personal,69,Fort Worth,Healthcare,Extremely satisfied,Sodales montes ultricies augue rutrum pede purus malesuada cras sollicitudin proin quis rutrum mauris nec.
personal,51,Fort Worth,Consulting,Neither satisfied nor dissatisfied,"Wisi? Consequat curabitur duis donec integer accusamus! Integer non molestie, natoque wisi maecenas quam lacus."
personal,82,San Antonio,Consulting,Neither satisfied nor dissatisfied,"Leo. Mattis ullamcorper fusce. Natoque proin? Dui blandit velit porta euismod. Ultricies, sodales porttitor sem."
personal,66,Dallas,Consulting,Extremely dissatisfied,Mi auctor lectus? Ligula neque elit facilisi aliquam velit magnis ullamcorper donec ac natoque curabitur.
personal,71,San Antonio,Healthcare,Extremely dissatisfied,Erat venenatis. Aliquet vestibulum ut sem ridiculus dapibus ante. Convallis dapibus rhoncus.
personal,27,Dallas,Healthcare,Somewhat satisfied,Molestie! Ac enim vestibulum non justo neque donec? Cursus mattis.
personal,84,Austin,Government Services,Somewhat dissatisfied,Nullam sollicitudin? Risus rutrum per turpis euismod enim. Sodales nunc. Suspendisse.
personal,34,Houston,Healthcare,Extremely dissatisfied,"Porttitor pharetra nunc faucibus, viverra dignissim, nunc. Euismod dapibus lorem! Fringilla. Temporibus."
personal,52,Dallas,Healthcare,Somewhat dissatisfied,"Augue primis auctor vitae. Fusce! Purus? Elit lacus in vestibulum, per accumsan, convallis."
personal,19,Houston,Technology,Extremely dissatisfied,"Iaculis dui tempor? Lacus porttitor. Suscipit nonummy, wisi morbi, leo."
personal,66,Fort Worth,Healthcare,Somewhat dissatisfied,"Sed? Arcu dolorem. Aliquet cursus. Sit facilisi! Commodo, pharetra tincidunt ligula."
personal,20,Austin,Government Services,Extremely satisfied,Velit atque! Ultrices nibh aenean porttitor dictumst natoque convallis tempora wisi.
personal,85,Dallas,Government Services,Neither satisfied nor dissatisfied,Facilisi? Vel ab eu! Gravida auctor cursus duis mi molestie. Porta per cras ridiculus.
personal,20,Austin,Consulting,Somewhat satisfied,Ipsum molestie montes. Orci ac! Pede. Magna vulputate. Elementum atque imperdiet nonummy.
personal,75,Houston,Healthcare,Neither satisfied nor dissatisfied,Erat nunc etiam ultricies? Pellentesque. Scelerisque diam dictumst quam! Massa ridiculus tincidunt.
personal,70,Dallas,Energy,Somewhat satisfied,Fusce sit dictumst lorem? Ultricies rutrum arcu consequat odio magna dignissim quis laoreet odio! Aliquam.
personal,93,San Antonio,Technology,Extremely satisfied,Gravida magna ipsum leo vel porta platea pede. Pharetra sed lacus. Vestibulum.
personal,65,Houston,Healthcare,Somewhat satisfied,"Ultrices ultricies eleifend turpis blandit, fringilla luctus posuere porta primis tempus scelerisque nulla eget vulputate."
personal,83,Fort Worth,Consulting,Extremely dissatisfied,Fusce id culpa posuere. Tempus donec placerat fermentum metus natoque. Consequat erat.
personal,36,Austin,Government Services,Somewhat satisfied,"Accumsan sagittis, per ipsum mauris! Aliquam ultricies at felis integer maecenas luctus sapien! Platea enim."
personal,48,Dallas,Energy,Somewhat satisfied,Consectetuer interdum imperdiet risus posuere et? Fringilla potenti pede luctus volutpat vestibulum enim.
personal,100,San Antonio,Government Services,Extremely dissatisfied,"Primis ultrices non. Nullam nibh, natoque, rhoncus praesent, montes? Dolorem elit."
personal,57,Austin,Energy,Somewhat satisfied,Sapien donec amet est aenean proin. Interdum at montes malesuada? Pretium turpis massa praesent.
personal,43,Houston,Consulting,Neither satisfied nor dissatisfied,Suscipit. Laoreet interdum? Tempora tincidunt nulla ante erat fringilla ac.
personal,81,San Antonio,Healthcare,Extremely dissatisfied,Ultrices ultrices. Quis porta scelerisque temporibus elementum. Praesent at mauris cras eleifend ipsum.
personal,74,Houston,Government Services,Extremely dissatisfied,Platea justo sapien. Etiam. Morbi tempora et pretium erat potenti metus. Suscipit faucibus.
personal,58,Austin,Energy,Neither satisfied nor dissatisfied,Aenean proin ligula purus neque ac blandit mattis fringilla potenti eros orci per? Vestibulum! Fringilla.
personal,70,Austin,Healthcare,Extremely dissatisfied,"Egestas posuere curabitur potenti aliquam quam, felis et morbi aliquam vulputate primis arcu."
personal,33,San Antonio,Technology,Somewhat dissatisfied,"Vulputate ligula auctor turpis pharetra. Temporibus fermentum eget felis, ligula! Tempor aenean fusce."
personal,29,San Antonio,Energy,Extremely satisfied,Ullamcorper. Dapibus tincidunt maecenas posuere convallis eu phasellus. Dapibus. Cras! Commodo.
personal,59,Austin,Government Services,Extremely satisfied,In ridiculus lorem dignissim convallis praesent rutrum temporibus vulputate wisi donec ultricies aliquet felis egestas.
personal,69,San Antonio,Energy,Neither satisfied nor dissatisfied,Velit ullamcorper aliquam convallis nullam molestie fringilla culpa eget vel? Ante wisi? Tempora.
personal,79,San Antonio,Government Services,Somewhat satisfied,Justo ridiculus ultrices aenean ante culpa? Duis luctus molestie! Tempus elementum.
personal,82,San Antonio,Government Services,Neither satisfied nor dissatisfied,Pellentesque gravida wisi iaculis lacus suspendisse mauris tempor iaculis porta vestibulum facilisis temporibus.
personal,88,Dallas,Technology,Extremely dissatisfied,"Mattis auctor facilisi curabitur placerat vitae, lectus, tempus velit. Dolor vestibulum natoque pharetra quis. Viverra."
personal,58,Austin,Energy,Extremely dissatisfied,"Maecenas, enim donec sagittis pharetra! Leo blandit! Laoreet augue vel platea atque! Vel fermentum amet."
personal,31,Houston,Healthcare,Somewhat satisfied,Dui temporibus mauris fringilla malesuada nibh dolor iaculis suspendisse diam ac. Ultricies! Imperdiet pretium.
personal,52,Austin,Technology,Extremely satisfied,Morbi posuere convallis culpa! Dolorem egestas? Sollicitudin lacus sed culpa.
personal,29,Dallas,Consulting,Extremely dissatisfied,Accumsan sem ipsum natoque ac accumsan. Eros ligula convallis ut facilisis.
personal,89,Dallas,Technology,Extremely satisfied,Nunc ultrices amet sodales nonummy volutpat elementum facilisi? Lectus nunc at platea.
personal,69,San Antonio,Government Services,Extremely satisfied,Ut vel elementum ac ut pede rutrum. Tortor dignissim volutpat mi ultrices.
personal,26,San Antonio,Energy,Somewhat dissatisfied,Id imperdiet sodales! Mi vehicula magnis! Wisi cursus posuere! Nibh quam eu vel.
personal,36,San Antonio,Technology,Neither satisfied nor dissatisfied,Vulputate accumsan pharetra quam sapien cursus molestie lacus primis lorem tempora lacus magna magnis.
personal,88,Houston,Consulting,Somewhat satisfied,"Velit? Egestas tincidunt pede lacus bibendum convallis metus, interdum dui maecenas."
personal,56,San Antonio,Consulting,Extremely satisfied,Eros vulputate neque atque ut egestas dignissim rutrum pretium velit vitae vitae.
personal,57,Austin,Consulting,Somewhat dissatisfied,Egestas dui felis dapibus. Interdum eu culpa sapien pede justo euismod. Per potenti accusamus.
personal,92,Houston,Consulting,Somewhat dissatisfied,Posuere fusce sollicitudin pretium dui pharetra quam at odio cursus sagittis vehicula ipsum vestibulum.
personal,66,Austin,Energy,Neither satisfied nor dissatisfied,Consectetuer gravida sapien viverra tempus nibh elementum fringilla. Eget placerat ridiculus.
personal,39,Austin,Healthcare,Somewhat satisfied,Bibendum est sollicitudin. Vulputate. Primis. Vivamus eget eu odio nonummy. Wisi arcu commodo.
personal,46,Austin,Technology,Somewhat dissatisfied,Proin duis tellus! Ab sollicitudin egestas odio nulla sit montes? Sem.
personal,61,Dallas,Government Services,Extremely satisfied,"Convallis porta, nibh viverra? Pellentesque platea facilisis quis integer fermentum tellus faucibus."
personal,60,Houston,Energy,Extremely dissatisfied,Amet duis volutpat tincidunt neque cras convallis risus id magnis felis. Atque sem justo.
personal,43,Austin,Consulting,Extremely dissatisfied,Culpa ut cras eros donec laoreet fringilla sit rutrum aenean sed! Facilisis.
personal,26,Fort Worth,Government Services,Extremely dissatisfied,"Diam a tincidunt rhoncus? Purus proin, pede sed atque vivamus, turpis orci."
personal,49,Houston,Technology,Somewhat dissatisfied,Facilisi a aliquet ultricies ligula mattis. Tellus magnis consectetuer tempor nunc.
personal,85,Houston,Consulting,Somewhat dissatisfied,Phasellus fusce wisi auctor viverra! Facilisi ab at. Sagittis. Venenatis placerat.
personal,57,San Antonio,Technology,Somewhat satisfied,Pharetra pellentesque magnis. Orci dolor malesuada suscipit purus vehicula neque.
personal,29,Fort Worth,Government Services,Neither satisfied nor dissatisfied,"Tempora, dolorem ridiculus a turpis rhoncus neque temporibus tellus tempora, fringilla at."
personal,31,Dallas,Energy,Extremely dissatisfied,Culpa potenti fringilla id dictumst quam ultricies tellus platea. Dolorem bibendum tortor! Imperdiet purus.
personal,93,Fort Worth,Technology,Extremely dissatisfied,Ante montes dolorem! Cras velit sagittis sodales vivamus elementum suspendisse pellentesque. Pede. Pellentesque.
personal,85,Fort Worth,Healthcare,Extremely dissatisfied,Accumsan! Rhoncus! Neque egestas vitae culpa arcu pellentesque. Eget convallis vitae.
personal,77,Dallas,Technology,Extremely satisfied,"Quis nullam fermentum dapibus suspendisse sodales! Euismod quam. Eleifend rhoncus, odio sollicitudin primis nullam."
personal,97,Austin,Government Services,Extremely satisfied,Mattis! Mattis? Tellus. Vulputate? Nulla dictumst sit sollicitudin at ultrices etiam eu bibendum gravida commodo.
personal,27,Austin,Consulting,Somewhat dissatisfied,Sapien rutrum montes nunc. Magnis dapibus phasellus! Velit. Cras felis non.
personal,74,Dallas,Energy,Neither satisfied nor dissatisfied,Eleifend. Ultricies enim dolorem dui primis montes! Magnis ipsum cursus morbi.
personal,43,San Antonio,Healthcare,Somewhat satisfied,"Luctus ac? Leo. Luctus laoreet, sagittis vitae volutpat urna massa duis montes elit erat."
personal,28,San Antonio,Healthcare,Neither satisfied nor dissatisfied,"Duis, elementum dapibus, placerat! Nunc rhoncus est luctus facilisis rhoncus nec nullam ipsum."
personal,47,Fort Worth,Technology,Extremely satisfied,Facilisi suspendisse nonummy magna temporibus turpis tempora metus viverra pretium vel pretium? Non convallis phasellus.
personal,77,San Antonio,Healthcare,Extremely dissatisfied,"Culpa. Amet proin est. Eros, vulputate, eget gravida cursus felis velit, tincidunt eros elementum! Ut."
personal,100,Fort Worth,Government Services,Extremely satisfied,Ac arcu? Etiam. Fermentum. Elementum sem. Nunc pellentesque per et velit orci.
personal,20,Houston,Consulting,Somewhat dissatisfied,Vivamus fringilla potenti aliquet rutrum nullam montes tempora sed ac.
personal,92,Houston,Healthcare,Extremely satisfied,Et magna accusamus? Sapien nulla massa? Pretium lectus donec. Dignissim rhoncus tempus duis sed.
personal,50,San Antonio,Technology,Neither satisfied nor dissatisfied,"Praesent duis erat primis ipsum, vel molestie dignissim. Faucibus etiam."
personal,77,Austin,Consulting,Neither satisfied nor dissatisfied,Placerat dictumst sit dolor a duis ridiculus donec id suspendisse tempor? Gravida justo.
personal,47,Fort Worth,Government Services,Somewhat dissatisfied,"Potenti duis sollicitudin, ipsum volutpat magna quis vehicula, mauris auctor integer at, porta etiam."
personal,52,Fort Worth,Healthcare,Extremely satisfied,Dolor non erat. Phasellus sollicitudin integer justo pede nunc aliquet suscipit ac? Malesuada.
personal,51,Fort Worth,Energy,Somewhat dissatisfied,"Ligula vestibulum viverra. Commodo dui ultricies leo, vestibulum potenti temporibus."
personal,21,Fort Worth,Healthcare,Extremely dissatisfied,Culpa mi culpa ligula. Tortor fermentum luctus dolor euismod consectetuer.
personal,36,Fort Worth,Government Services,Neither satisfied nor dissatisfied,"Primis suspendisse, id posuere pretium? Gravida nibh, viverra per venenatis? Justo proin."
