survey_name,Q1,Q2,Q3,Q4,Q5
personal,91,Austin,Energy,Neither satisfied nor dissatisfied,"Blandit eros! A, ligula facilisis imperdiet! Interdum placerat, nec cursus."
personal,32,San Antonio,Healthcare,Extremely satisfied,Elementum. Ante placerat. Arcu viverra! Montes tempor wisi. Consequat ultrices.
personal,40,San Antonio,Consulting,Somewhat dissatisfied,"Eget. Tellus aliquam integer. Volutpat nonummy, egestas eget imperdiet duis! Imperdiet leo ultricies rhoncus facilisi."
personal,23,Austin,Consulting,Extremely satisfied,Scelerisque cras primis felis? Tincidunt sapien scelerisque? Ipsum temporibus ipsum elementum consectetuer mauris.
personal,88,Dallas,Technology,Neither satisfied nor dissatisfied,Aenean! Per commodo elementum id sollicitudin proin eu! Lacus viverra ipsum dolorem amet dignissim.
personal,69,Fort Worth,Technology,Neither satisfied nor dissatisfied,"Integer pretium diam! Convallis natoque faucibus quis, turpis mi placerat? Duis tincidunt."
personal,96,Houston,Healthcare,Extremely dissatisfied,"Blandit proin gravida facilisis tortor etiam urna. Odio! Fringilla tellus, gravida tincidunt maecenas."
personal,40,Houston,Consulting,Extremely satisfied,"Scelerisque curabitur. Lectus natoque, vestibulum et? Enim leo nunc auctor tempus."
personal,57,Fort Worth,Energy,Extremely satisfied,"Pede nonummy! Platea, vel mi sapien sed vulputate blandit tempora sed bibendum turpis."
personal,40,Fort Worth,Healthcare,Extremely dissatisfied,Pharetra eget aliquam elit eros? Placerat consectetuer lacus? Blandit odio? Neque.
personal,39,Dallas,Government Services,Extremely dissatisfied,Magnis dapibus fermentum? Non suspendisse molestie duis dictumst? Etiam elementum per rutrum nibh.
personal,70,San Antonio,Consulting,Neither satisfied nor dissatisfied,"Cras! Curabitur cras aenean diam dolorem natoque eu! Urna, phasellus, augue at."
personal,29,Dallas,Technology,Extremely dissatisfied,"Dignissim. Sapien fringilla luctus consequat cras malesuada primis ullamcorper, iaculis vel porta."
personal,38,Dallas,Government Services,Extremely satisfied,"Non ligula pellentesque, ab faucibus risus magna blandit at viverra venenatis sed? A."
personal,57,San Antonio,Energy,Extremely dissatisfied,"Posuere, lorem temporibus at, nec egestas ridiculus! Lacus ipsum posuere non, ab tempor."
personal,43,San Antonio,Consulting,Neither satisfied nor dissatisfied,"Venenatis sollicitudin. Eget ridiculus laoreet ridiculus, quis. Magnis enim primis ridiculus fermentum culpa."
personal,49,San Antonio,Technology,Extremely satisfied,"Erat, natoque porta. Elementum est mattis gravida eleifend luctus aenean porta."
personal,34,Fort Worth,Government Services,Neither satisfied nor dissatisfied,Ab sit sit laoreet temporibus mi proin. Dignissim erat? Ut dignissim.
personal,40,Austin,Energy,Extremely satisfied,"Lacus facilisis, sem enim posuere per praesent maecenas eleifend eu! Dignissim fusce lacus potenti."
personal,19,San Antonio,Government Services,Somewhat satisfied,Atque commodo porttitor consequat sodales nec tempor? Sed cras nibh ultricies cras.
personal,95,Austin,Government Services,Somewhat satisfied,"Morbi donec curabitur egestas ac montes, tincidunt placerat rhoncus orci pharetra dolor pellentesque."
personal,94,Austin,Healthcare,Neither satisfied nor dissatisfied,"Curabitur tincidunt luctus. Ut cras eget proin volutpat rutrum curabitur praesent rhoncus aliquam, donec."
personal,76,Houston,Healthcare,Somewhat dissatisfied,"Ipsum ut volutpat viverra, purus faucibus et bibendum vitae fringilla montes non ultrices quis."
personal,28,Dallas,Energy,Somewhat satisfied,In tempora proin quam posuere vehicula molestie! Eros aliquet egestas. Lectus.
personal,71,Houston,Government Services,Extremely dissatisfied,Eros massa sed scelerisque amet maecenas magnis tincidunt. Euismod a vulputate! Odio integer venenatis.
personal,89,San Antonio,Healthcare,Neither satisfied nor dissatisfied,"Nec tempor interdum! Neque? Duis interdum! Tempor potenti at, molestie, neque phasellus! Commodo."
personal,86,Fort Worth,Government Services,Neither satisfied nor dissatisfied,Vivamus. Euismod! Euismod commodo felis id fermentum rutrum blandit fermentum pretium pharetra ultricies.
personal,61,San Antonio,Energy,Extremely dissatisfied,"Augue, massa phasellus, consequat pretium praesent velit interdum ligula porta mauris sagittis consequat scelerisque."
personal,89,Houston,Consulting,Extremely dissatisfied,"Quam, consectetuer. Ante quam porttitor at. Facilisi ante et lorem potenti facilisi dictumst proin."
personal,52,Houston,Government Services,Somewhat satisfied,"Ultricies lacus facilisis fusce wisi wisi per leo urna, laoreet mauris diam."
personal,81,Houston,Technology,Somewhat satisfied,Dolor justo blandit mi cras aenean. Rutrum ab augue augue vestibulum risus ante.
personal,95,Dallas,Healthcare,Extremely dissatisfied,"Platea montes justo quam rhoncus tellus! Ridiculus, ut sagittis donec."
personal,32,Houston,Technology,Extremely dissatisfied,Vehicula tempus sapien. Augue augue primis eget orci vulputate posuere? Massa orci dolorem! In. Pretium.
personal,27,Fort Worth,Technology,Somewhat dissatisfied,Ligula scelerisque blandit ut sapien sodales. At morbi ultrices atque.
personal,75,Houston,Technology,Somewhat dissatisfied,"Vitae fringilla placerat turpis accumsan? Purus viverra primis laoreet sodales. Duis, odio. Non tempus."
personal,43,Houston,Healthcare,Extremely dissatisfied,"Suspendisse ridiculus sem laoreet purus duis rutrum mattis facilisis faucibus, facilisis vulputate faucibus."
personal,83,Dallas,Government Services,Neither satisfied nor dissatisfied,Proin? Natoque pretium. Aliquam. Elit erat velit amet eros imperdiet. Phasellus vulputate enim.
personal,64,Austin,Consulting,Extremely dissatisfied,"Laoreet sollicitudin ullamcorper, pretium molestie erat nibh velit montes. Natoque. Fringilla, aliquam gravida atque cras."
personal,61,Austin,Technology,Somewhat satisfied,Scelerisque convallis! Suspendisse? Pretium tortor nunc aenean aliquam! Pellentesque nulla? Consectetuer! Fermentum felis.
personal,35,San Antonio,Energy,Somewhat dissatisfied,"Dignissim facilisi id at, curabitur? Urna! Vivamus commodo et wisi. Posuere? Per sit wisi egestas."
personal,52,Houston,Technology,Extremely satisfied,"Proin leo fringilla sed tellus nonummy convallis sollicitudin magnis vel rhoncus, urna tempus."
personal,64,Houston,Healthcare,Extremely dissatisfied,"Pellentesque gravida massa. Tempor nonummy posuere elementum integer augue, vulputate volutpat! Imperdiet? Tempor. Eu."
personal,87,San Antonio,Healthcare,Extremely dissatisfied,Sagittis morbi at sodales pellentesque vulputate dolor dui commodo. Primis dui ultricies sollicitudin ac.
personal,56,Austin,Government Services,Neither satisfied nor dissatisfied,"Potenti. Turpis magna tellus wisi molestie sed amet id, ridiculus."
personal,69,Dallas,Government Services,Extremely satisfied,"Duis orci? Euismod proin tempus neque facilisis vel, ultricies quam platea sagittis ut per."
personal,20,Houston,Government Services,Somewhat dissatisfied,Blandit morbi. Velit fusce dolorem leo wisi! Orci consequat sollicitudin pharetra aliquet.
personal,48,San Antonio,Consulting,Somewhat satisfied,Blandit cras. Iaculis imperdiet! Pede facilisis suscipit. Eleifend vitae arcu egestas potenti facilisis ante? Felis.
personal,66,San Antonio,Consulting,Extremely dissatisfied,"Eget natoque interdum. Tincidunt sollicitudin wisi nullam eleifend mi suscipit egestas vivamus! Porttitor fermentum, interdum."
personal,73,Houston,Consulting,Extremely satisfied,"Integer imperdiet elit luctus, nullam lorem lacus, non vel at sagittis nunc, suspendisse."
personal,22,Houston,Consulting,Somewhat satisfied,Fusce? Porttitor praesent. Pede faucibus tellus primis sed pharetra curabitur id viverra? Est.
personal,69,San Antonio,Consulting,Extremely satisfied,Vivamus consectetuer. Malesuada platea magna potenti consectetuer dignissim rutrum duis sagittis viverra orci.
personal,95,Austin,Healthcare,Extremely dissatisfied,In orci vivamus orci pellentesque consequat atque ac curabitur orci.
personal,67,Houston,Energy,Somewhat dissatisfied,Nibh velit fermentum dignissim culpa! Luctus iaculis phasellus venenatis. Amet.
personal,60,San Antonio,Energy,Extremely dissatisfied,Elit lacus risus. Fringilla ac pharetra cursus odio tellus nulla.
personal,36,Houston,Consulting,Extremely dissatisfied,Scelerisque imperdiet leo ut! Pede praesent interdum rutrum nulla mattis dapibus commodo in? Velit. Tempor.
personal,80,Fort Worth,Technology,Extremely satisfied,"Accusamus vel, eros rhoncus ut sem nullam luctus vulputate, mauris phasellus nonummy purus in."
personal,92,Dallas,Government Services,Somewhat satisfied,Vitae! Luctus id. Aliquam sagittis tellus velit? Culpa felis. Dapibus.
personal,62,San Antonio,Energy,Neither satisfied nor dissatisfied,"Turpis tortor viverra nulla sem vel curabitur egestas, at nonummy mi! Augue sit auctor? Convallis."
personal,56,Austin,Consulting,Extremely satisfied,"Temporibus convallis. Malesuada magna urna, aenean gravida justo sodales wisi facilisis sit rutrum blandit."
personal,69,Fort Worth,Consulting,Somewhat dissatisfied,Vitae! Tempus? Pede. Temporibus sollicitudin at? Ac nulla tempora? Consectetuer commodo facilisi ante.
personal,27,Dallas,Healthcare,Extremely dissatisfied,"Primis nullam maecenas. Vivamus neque laoreet pharetra tincidunt eleifend euismod, porta ullamcorper est morbi gravida."
personal,98,Dallas,Government Services,Extremely satisfied,"Interdum massa enim! Viverra natoque! Leo, turpis nulla! Per iaculis accumsan. Interdum per."
personal,95,Austin,Energy,Somewhat satisfied,"Sollicitudin tempor volutpat dolorem lectus luctus aenean fermentum sed justo, morbi facilisi a fusce."
personal,47,Austin,Healthcare,Neither satisfied nor dissatisfied,"Luctus. Temporibus mauris, eget eleifend justo, vivamus auctor luctus wisi. Eu."
personal,100,San Antonio,Healthcare,Somewhat satisfied,"Scelerisque sagittis a aliquet magna placerat amet? A, ab aliquet. Mauris platea! Magna eu malesuada."
personal,87,San Antonio,Government Services,Somewhat satisfied,Est mi sollicitudin gravida eu accumsan leo facilisis placerat. In consequat luctus. Dolor dapibus mauris.
personal,61,San Antonio,Energy,Extremely dissatisfied,Consectetuer. Morbi primis fusce donec duis. Odio blandit blandit temporibus tempora.
personal,29,Houston,Government Services,Extremely dissatisfied,Egestas quis. Mi pede enim aliquam praesent ab pharetra nunc.
personal,48,Houston,Government Services,Extremely dissatisfied,"Id euismod. Tempor? Pharetra primis molestie, non nullam atque eget massa? Pellentesque enim! Dapibus."
personal,79,San Antonio,Government Services,Neither satisfied nor dissatisfied,Leo? Amet suscipit metus. Est cursus enim potenti praesent dui consectetuer! Felis vivamus fringilla.
personal,59,Dallas,Consulting,Somewhat dissatisfied,"Fringilla porttitor justo praesent. Tempus, sagittis risus eleifend tortor cursus."
personal,20,San Antonio,Consulting,Somewhat dissatisfied,Phasellus facilisi in neque eros? Amet quam! Vel cras sapien.
personal,72,Austin,Technology,Somewhat satisfied,"Facilisi, vitae enim sagittis mauris egestas, tempor! Ridiculus dui quis."
personal,89,Dallas,Government Services,Somewhat satisfied,"Augue dolorem dictumst, primis lacus amet, vivamus. Ultricies suspendisse imperdiet dictumst."
personal,48,San Antonio,Government Services,Extremely satisfied,Duis praesent rhoncus? Tempora eleifend ligula tincidunt! Leo lorem. Vestibulum platea.
personal,67,Houston,Healthcare,Somewhat dissatisfied,"Platea mattis! Erat luctus metus, magnis elit? Malesuada nec curabitur praesent sollicitudin."
personal,52,Austin,Technology,Extremely dissatisfied,Magna dignissim egestas montes dolorem vehicula tempus? Blandit venenatis euismod venenatis. Augue dignissim.
personal,82,Fort Worth,Energy,Somewhat satisfied,"Dictumst pede, pede vel neque velit tincidunt diam nonummy suspendisse sem pretium risus."
personal,41,Austin,Technology,Extremely dissatisfied,Gravida amet. Dapibus temporibus primis pede sed vitae a interdum est duis posuere.
personal,73,Fort Worth,Government Services,Extremely dissatisfied,Pharetra commodo lacus vulputate ac malesuada mattis ac enim faucibus nec egestas.
personal,78,San Antonio,Consulting,Neither satisfied nor dissatisfied,Elit pede justo! Est. Montes blandit porta. Culpa auctor at interdum.
personal,51,Dallas,Healthcare,Somewhat satisfied,Potenti felis consequat? Tempus nec gravida urna gravida culpa nulla culpa.
personal,30,Houston,Healthcare,Extremely dissatisfied,Consequat. Maecenas. Dapibus diam culpa neque facilisis porta arcu a orci? Dictumst enim.
personal,22,Houston,Energy,Extremely dissatisfied,"Dictumst iaculis venenatis purus platea tincidunt elit odio, sodales velit. Vehicula."
personal,51,San Antonio,Healthcare,Neither satisfied nor dissatisfied,Mattis fringilla ipsum nunc ac amet et malesuada dolorem tempor.
personal,97,Dallas,Consulting,Neither satisfied nor dissatisfied,Risus. Enim vel ipsum quam velit massa! Est aliquam. Odio praesent tincidunt.
personal,25,Fort Worth,Government Services,Somewhat satisfied,Vivamus fermentum. Augue bibendum wisi praesent ut. Vehicula tempor id tortor massa.
personal,46,Houston,Healthcare,Somewhat satisfied,"Fusce egestas lacus fermentum ridiculus porttitor tortor, arcu elementum ante eleifend."
personal,57,Houston,Technology,Neither satisfied nor dissatisfied,"Non nonummy et lacus tincidunt consequat sed, rhoncus. Non fringilla. Tempor. Lectus? At porttitor."
personal,26,Houston,Energy,Neither satisfied nor dissatisfied,"Ipsum dolor cras? Facilisi ridiculus metus quam, duis integer! Lorem."
personal,50,Austin,Technology,Neither satisfied nor dissatisfied,Risus ac nibh viverra metus. Scelerisque non! Volutpat donec nec tempus. Accusamus.
personal,80,Austin,Technology,Somewhat dissatisfied,Vestibulum ipsum lectus viverra facilisi aenean euismod erat at ac morbi.
personal,39,Fort Worth,Healthcare,Somewhat dissatisfied,"Iaculis, rhoncus. Tempor! Accusamus. Velit at potenti magnis! Suspendisse felis pharetra phasellus placerat. Ridiculus faucibus."
personal,25,San Antonio,Energy,Somewhat satisfied,"Ullamcorper? Augue natoque, ultrices temporibus molestie nibh sagittis risus donec."
personal,80,Austin,Energy,Somewhat satisfied,"Ac imperdiet quam etiam integer tortor tincidunt euismod. Duis pellentesque, ligula dui bibendum orci."
personal,85,Dallas,Technology,Somewhat satisfied,Lacus tincidunt platea neque! Magnis natoque dolorem orci porttitor malesuada facilisis blandit vehicula.
personal,97,Fort Worth,Healthcare,Somewhat satisfied,"Aliquet luctus platea cursus auctor sit, at nulla! Porta nibh enim."
personal,81,Houston,Consulting,Somewhat satisfied,Atque pharetra bibendum curabitur ab dapibus pede. Fermentum sed lorem. Eros.
personal,98,San Antonio,Government Services,Somewhat dissatisfied,"Metus felis! Arcu. Suspendisse nunc faucibus convallis leo turpis amet, suspendisse nulla suscipit orci! Consequat."
personal,56,Austin,Consulting,Somewhat dissatisfied,"Volutpat, aliquet elementum mauris natoque in faucibus dignissim consectetuer at facilisi risus porttitor quis cras."
personal,85,Fort Worth,Government Services,Neither satisfied nor dissatisfied,"Vestibulum orci aenean aliquet, sagittis etiam amet consequat tempor elementum odio."
personal,70,Houston,Government Services,Neither satisfied nor dissatisfied,"Consequat, ligula sem facilisis ab? Ac. Cras, pretium primis pede? Donec."
personal,77,Dallas,Energy,Somewhat satisfied,Nunc cras lacus nulla euismod. Euismod ac lacus blandit quam aliquet suspendisse praesent facilisi montes.
personal,80,Houston,Consulting,Extremely satisfied,Accusamus odio natoque? Aliquam turpis fringilla ultrices interdum non amet vulputate.
personal,84,San Antonio,Energy,Somewhat satisfied,"Eros? Cursus culpa, mauris arcu et. Fringilla nullam. Vulputate maecenas ac cras duis? Magna."
personal,64,Austin,Government Services,Somewhat satisfied,"Consequat integer suspendisse praesent nonummy. Quis non wisi neque, urna dolorem in."
personal,73,Dallas,Government Services,Neither satisfied nor dissatisfied,"Sapien dapibus fringilla? At molestie venenatis, eleifend natoque dolorem sem platea! Metus."
personal,18,San Antonio,Technology,Somewhat satisfied,Tempus blandit facilisis. Temporibus posuere scelerisque ante erat orci placerat odio est augue ullamcorper velit.
personal,40,Dallas,Government Services,Neither satisfied nor dissatisfied,Pellentesque? Ut potenti neque posuere pede commodo vehicula posuere imperdiet dolor purus ipsum imperdiet aliquam.
personal,95,Houston,Energy,Somewhat satisfied,"Sagittis dictumst. Wisi. Eget dapibus, ridiculus malesuada vitae! Justo imperdiet integer potenti tellus."
personal,75,San Antonio,Technology,Somewhat satisfied,"Amet non dui accumsan enim, vitae platea accusamus dui nullam ullamcorper. Consectetuer tortor."
personal,63,San Antonio,Technology,Extremely dissatisfied,"Neque. Nec, porta aliquet tempus nibh fusce montes lorem dignissim velit duis posuere! Primis."
personal,21,Austin,Technology,Somewhat dissatisfied,"Facilisis venenatis tortor non, accusamus sem platea vitae tempor magna ab? Natoque augue! Pretium."
personal,44,San Antonio,Healthcare,Somewhat satisfied,"Id dolor nibh. Magnis tempora. Lectus urna convallis, viverra justo."
personal,56,San Antonio,Technology,Extremely satisfied,Vehicula suscipit laoreet proin pharetra arcu gravida gravida atque magna lacus? Mattis blandit id? Risus.
personal,34,Houston,Healthcare,Extremely satisfied,"Aliquet velit arcu id suscipit in ligula felis cursus, potenti."
personal,57,San Antonio,Technology,Extremely dissatisfied,Erat volutpat lectus quam atque praesent potenti amet sed arcu.
personal,96,Houston,Energy,Somewhat dissatisfied,Porttitor rhoncus vivamus? Porttitor id risus primis massa amet! Ullamcorper gravida felis nulla consequat bibendum.
personal,75,Austin,Energy,Extremely satisfied,Venenatis. Molestie. Ipsum pede tincidunt auctor natoque? Diam blandit. Blandit suspendisse.
personal,36,Dallas,Healthcare,Somewhat dissatisfied,Mi commodo. Porta venenatis fermentum accusamus donec neque. Quam posuere.
personal,57,San Antonio,Healthcare,Somewhat satisfied,"Ligula. Vivamus. Tempor donec placerat neque eleifend, suspendisse fringilla etiam molestie diam."
personal,20,Houston,Healthcare,Extremely dissatisfied,Facilisis dignissim morbi? Per scelerisque dapibus? Sem fusce viverra. Diam duis. Quam integer.
personal,29,Austin,Government Services,Somewhat satisfied,Curabitur. Luctus at blandit? Venenatis arcu eros tortor accusamus sapien.
personal,56,Dallas,Government Services,Somewhat dissatisfied,Nunc suspendisse neque fusce sagittis ipsum tincidunt? Eu. Et tincidunt euismod luctus rutrum duis aliquam.
personal,48,Austin,Consulting,Extremely dissatisfied,Viverra potenti viverra ab nulla mattis! Fusce mauris blandit accusamus accumsan non diam.
personal,19,San Antonio,Consulting,Extremely satisfied,Ullamcorper interdum euismod etiam cras erat? Etiam augue gravida mattis egestas.
personal,93,Dallas,Energy,Extremely satisfied,Malesuada sed malesuada. Ligula arcu mi facilisi maecenas praesent phasellus blandit non purus sem.
personal,61,Dallas,Technology,Neither satisfied nor dissatisfied,"Accusamus! At platea, eget dapibus convallis fringilla mattis. Egestas magnis? Molestie a. Consequat."
personal,60,Dallas,Technology,Extremely dissatisfied,Vestibulum viverra ultrices sagittis orci enim magnis enim faucibus! Mi velit.
personal,68,San Antonio,Government Services,Somewhat dissatisfied,Quis pede sollicitudin! Ac neque eu ac! Eget vulputate porta phasellus urna dignissim primis laoreet.
personal,49,San Antonio,Consulting,Extremely dissatisfied,"Ipsum at, cras luctus! Gravida purus massa ligula vestibulum non est sit tempus sollicitudin."
personal,80,Fort Worth,Healthcare,Extremely satisfied,Integer tincidunt lorem? Eros quam augue cras blandit porta per? Culpa primis! Bibendum sagittis nullam.
personal,21,Houston,Government Services,Extremely satisfied,"Risus rutrum pharetra cursus donec rhoncus elit cras, elementum orci in."
personal,86,Houston,Healthcare,Neither satisfied nor dissatisfied,Viverra laoreet enim diam venenatis etiam maecenas justo dolor sem.
personal,91,Dallas,Consulting,Neither satisfied nor dissatisfied,Volutpat amet arcu! Imperdiet? Nulla suspendisse ultrices et at! Blandit.
personal,71,Houston,Healthcare,Neither satisfied nor dissatisfied,"Amet velit sed tempor pede! Bibendum blandit natoque facilisi! Gravida posuere massa, accumsan."
personal,38,Fort Worth,Government Services,Neither satisfied nor dissatisfied,Tincidunt magnis phasellus nullam. Per lectus per ipsum purus wisi lectus orci. Sit aenean. Mattis.
personal,82,Austin,Healthcare,Somewhat satisfied,"Ullamcorper tellus! Accusamus pellentesque tellus fusce dignissim. Purus, egestas auctor, dictumst, at."
personal,81,Fort Worth,Energy,Somewhat satisfied,Platea arcu fermentum! Dolor! Nunc diam velit at? Mattis vitae consectetuer.
personal,61,Dallas,Consulting,Extremely satisfied,Rutrum egestas phasellus leo? Et. Nec sapien accumsan. Nulla! Ligula dapibus consectetuer pharetra scelerisque.
personal,48,Fort Worth,Government Services,Somewhat satisfied,"Per, nec lectus maecenas! Ante. Tempora platea non? Phasellus nonummy, quam a ridiculus accumsan."
personal,78,Fort Worth,Energy,Somewhat satisfied,Primis primis elementum pede et in sapien posuere quis proin. Vulputate! Ab.
personal,93,Dallas,Consulting,Somewhat satisfied,"Ipsum vulputate culpa tempus curabitur, dignissim venenatis donec commodo nibh ullamcorper? Luctus."
personal,84,San Antonio,Energy,Somewhat dissatisfied,"Eu consectetuer leo augue. Tincidunt tellus donec pellentesque eu fringilla, mattis lorem vel."
personal,19,Austin,Energy,Somewhat dissatisfied,Amet! Pretium wisi justo neque ab cursus. Gravida in culpa ante wisi.
personal,92,Dallas,Healthcare,Neither satisfied nor dissatisfied,Maecenas laoreet ultricies mattis vel pharetra. Primis. Aenean temporibus facilisis culpa.
personal,20,Austin,Healthcare,Somewhat satisfied,"Ac tortor laoreet pede elit commodo iaculis sit cras, ridiculus temporibus dignissim."
personal,65,Austin,Healthcare,Somewhat satisfied,Bibendum blandit suscipit primis eleifend donec dapibus euismod! Duis dapibus mattis suspendisse curabitur nullam.
personal,91,San Antonio,Government Services,Somewhat dissatisfied,Accusamus sit primis porttitor scelerisque proin sodales laoreet ultricies ligula donec.
personal,71,Houston,Government Services,Somewhat satisfied,"Blandit elementum. Atque proin. Leo fermentum, elementum pede. Mi justo erat."
personal,100,San Antonio,Technology,Somewhat satisfied,Pellentesque suspendisse aenean. Leo ac magna ultricies. Interdum eleifend ut duis.
personal,92,Fort Worth,Government Services,Somewhat satisfied,Ultrices fermentum accumsan malesuada ab! Per? Consequat posuere amet massa odio.
personal,98,Dallas,Technology,Somewhat satisfied,Rutrum. Malesuada platea maecenas posuere curabitur ante consequat urna proin! Potenti.
personal,25,San Antonio,Government Services,Extremely satisfied,Sollicitudin. Ridiculus elementum. Aenean phasellus ante dui. Urna dui consectetuer.
personal,25,San Antonio,Technology,Extremely satisfied,Potenti aliquam amet ultrices porta eu nunc platea. Velit sapien tempora elementum id accusamus suscipit.
personal,61,Houston,Energy,Somewhat dissatisfied,"Magnis natoque, culpa integer, cras massa id! Enim ultrices est aliquet venenatis vulputate."
personal,86,Austin,Consulting,Somewhat dissatisfied,"Porta id aliquet ac quam massa amet! Odio sit velit vitae montes vel risus, quam."
personal,56,Austin,Energy,Extremely satisfied,Nunc. Arcu non. Potenti aliquet elementum etiam nec augue porta.
personal,78,Fort Worth,Technology,Somewhat satisfied,"Mauris. At, pretium placerat arcu tempor fusce ultrices turpis metus, porttitor? Vulputate. Nulla tempor mattis."
personal,36,Dallas,Consulting,Extremely dissatisfied,Ullamcorper maecenas tempora laoreet felis risus! Dui? Urna laoreet phasellus? Risus non nec lectus iaculis.
personal,50,Fort Worth,Healthcare,Extremely dissatisfied,Lorem iaculis sem et nec. Ultrices vehicula integer. Nunc sapien temporibus id.
personal,61,San Antonio,Consulting,Neither satisfied nor dissatisfied,"Venenatis bibendum, ipsum metus non euismod accusamus facilisis lectus sem dolorem lorem montes."
personal,53,Houston,Consulting,Somewhat satisfied,Urna ante temporibus nulla tellus molestie imperdiet aliquam iaculis nonummy sem. Sem facilisis.
personal,73,Austin,Government Services,Somewhat satisfied,Malesuada! Nulla placerat nunc aliquet nibh. Per augue nibh felis. Aliquam tortor.
personal,96,Austin,Technology,Somewhat satisfied,"Porttitor tempus suscipit. Leo dapibus vitae ultricies primis ultricies, eget sem."
personal,84,Dallas,Government Services,Somewhat dissatisfied,Wisi. Vitae? Malesuada eleifend mi bibendum nunc? Suscipit gravida est aliquet arcu integer dolor.
personal,55,Austin,Government Services,Extremely dissatisfied,Tempus elementum vitae euismod! Ultrices tincidunt diam sapien! Cursus. Per sem! Cursus? Fermentum.
personal,83,Dallas,Technology,Neither satisfied nor dissatisfied,"Pede culpa massa aliquet vehicula tortor? Sapien per, aliquet dignissim. Nullam."
personal,39,Fort Worth,Consulting,Somewhat dissatisfied,Ultrices in? Donec dapibus placerat nonummy ullamcorper accusamus per at.
personal,39,Austin,Government Services,Neither satisfied nor dissatisfied,"Ridiculus vulputate porttitor, ligula suscipit dignissim duis proin erat. Et iaculis lacus."
personal,80,Fort Worth,Technology,Somewhat dissatisfied,Justo nullam! Eros laoreet maecenas nulla maecenas volutpat! Vehicula maecenas arcu.
personal,73,San Antonio,Technology,Somewhat satisfied,"Iaculis, per dapibus auctor rhoncus erat lacus! Mauris sit vel ullamcorper vehicula, primis ut erat."
