survey_name,Q1,Q2,Q3,Q4,Q5
personal,21,Austin,Technology,Neither satisfied nor dissatisfied,"Auctor, facilisi suspendisse sodales. Mi faucibus placerat aliquet ipsum vestibulum, arcu."
personal,30,San Antonio,Healthcare,Somewhat satisfied,"Facilisis lorem blandit augue posuere eleifend porttitor gravida, primis elementum! Vehicula aenean."
personal,76,Fort Worth,Government Services,Somewhat dissatisfied,Odio sem vitae pellentesque. Enim rutrum! Odio? Nibh mauris porta. Ipsum aenean? Accusamus sem.
personal,80,Austin,Government Services,Somewhat dissatisfied,"Praesent aenean sodales molestie rhoncus mattis euismod! Velit fringilla urna, nec."
personal,80,Fort Worth,Consulting,Somewhat dissatisfied,"Venenatis sed. Pellentesque. Proin temporibus ullamcorper mauris temporibus pharetra, vulputate."
personal,93,Fort Worth,Government Services,Neither satisfied nor dissatisfied,"Rhoncus fringilla, wisi suspendisse. Justo, et per, urna. Fermentum. Urna atque."
personal,39,Fort Worth,Energy,Extremely satisfied,"Convallis montes! Curabitur quis ultrices ridiculus praesent facilisi phasellus volutpat lectus arcu gravida, urna."
personal,40,Austin,Healthcare,Extremely dissatisfied,"Risus rutrum tempor, rutrum? Vivamus, molestie odio dapibus scelerisque eros iaculis."
personal,86,Austin,Healthcare,Extremely dissatisfied,Lectus sed pharetra dapibus justo quam nec egestas vestibulum nonummy.
personal,86,Houston,Government Services,Somewhat satisfied,Suspendisse per in quam dictumst mattis. Sagittis suspendisse potenti temporibus sed consequat erat. Elementum.
personal,72,Dallas,Consulting,Somewhat dissatisfied,"Tempora dui atque gravida! Ligula culpa! Sed auctor malesuada dui augue, rhoncus dignissim suspendisse! Tempor."
personal,79,Houston,Consulting,Somewhat satisfied,Magnis elit faucibus volutpat venenatis etiam proin magna. Aliquam fusce! Cras tempora imperdiet.
personal,99,Dallas,Healthcare,Extremely satisfied,"Temporibus pede, in neque fringilla? Eget a. Facilisi? Volutpat dictumst id porta eleifend."
personal,66,San Antonio,Healthcare,Neither satisfied nor dissatisfied,"Facilisis dui id ac rutrum, quis per est gravida. Ridiculus elementum? Culpa."
personal,36,Fort Worth,Government Services,Neither satisfied nor dissatisfied,"Elit ipsum euismod fusce, ridiculus? Tellus in erat pellentesque imperdiet? Tempus sodales odio."
personal,91,Austin,Technology,Somewhat satisfied,Fermentum tempus ac ac. Rutrum eu ut wisi justo dignissim nunc.
personal,81,Houston,Energy,Somewhat satisfied,Duis pellentesque pretium justo diam mattis diam morbi? Viverra dictumst praesent consequat natoque? Amet maecenas.
personal,34,Houston,Government Services,Somewhat dissatisfied,Tempor enim ut tincidunt nulla placerat ante aliquet. Tortor! Tincidunt posuere.
personal,69,Dallas,Technology,Somewhat dissatisfied,Primis ultricies. Tincidunt consectetuer? Vitae egestas commodo odio scelerisque faucibus tincidunt.
personal,79,Dallas,Technology,Somewhat dissatisfied,"Id et ac. Placerat, volutpat euismod massa porta imperdiet dui blandit molestie. Dignissim."
personal,96,Fort Worth,Technology,Somewhat satisfied,"Faucibus lectus, cursus tempor eleifend in fusce! Venenatis eu dictumst lacus! Pharetra."
personal,87,San Antonio,Energy,Extremely dissatisfied,Leo porttitor morbi maecenas suscipit interdum ridiculus cras nibh ultricies tempus.
personal,93,Austin,Energy,Extremely satisfied,Fringilla sapien. Accumsan dapibus sem pharetra non morbi? Eros arcu.
personal,84,Dallas,Healthcare,Neither satisfied nor dissatisfied,"Donec fringilla neque, ante erat aliquet nullam curabitur. Erat rutrum arcu, laoreet, integer."
personal,84,Dallas,Consulting,Extremely satisfied,"Sem tellus. Volutpat quam eu eros, donec pellentesque commodo dolor."
personal,73,Dallas,Government Services,Somewhat satisfied,"Maecenas ac facilisis. Nibh molestie viverra, velit ut atque magnis, nulla."
personal,92,Austin,Energy,Extremely satisfied,Aliquam suscipit scelerisque nibh bibendum molestie vel rhoncus porta integer potenti ipsum vivamus vitae? Duis.
personal,78,Houston,Energy,Somewhat dissatisfied,Ut sem turpis? Bibendum arcu vitae commodo sodales massa turpis lorem.
personal,89,Dallas,Consulting,Somewhat dissatisfied,"Metus nullam auctor ultricies nullam mattis accumsan? Dui rhoncus, nibh mi."
personal,24,San Antonio,Government Services,Extremely satisfied,Ullamcorper praesent! Proin facilisis turpis cursus per! Natoque blandit fusce mauris malesuada ridiculus. Elit per.
personal,84,Austin,Consulting,Extremely satisfied,Dapibus tortor donec. Cras nec accumsan accumsan tincidunt venenatis accusamus laoreet nonummy.
personal,38,San Antonio,Healthcare,Somewhat satisfied,Consectetuer? Tortor rutrum ut auctor tempora eleifend mi augue nulla odio justo porta convallis.
personal,55,Dallas,Energy,Somewhat satisfied,Fusce porta aliquam vulputate sem aenean cursus imperdiet ultrices velit nulla mi! Venenatis amet.
personal,48,Austin,Energy,Extremely dissatisfied,Interdum! Per. Non commodo ridiculus curabitur? Velit? Dolor leo laoreet dolor tempor. Quis luctus luctus.
personal,79,Fort Worth,Government Services,Somewhat dissatisfied,Morbi nec felis orci egestas ipsum! Mattis elit mauris vitae gravida.
personal,100,San Antonio,Consulting,Extremely satisfied,"Lorem montes? Vivamus urna. Pellentesque, in aenean elementum eleifend interdum dignissim gravida."
personal,38,San Antonio,Consulting,Neither satisfied nor dissatisfied,"Risus luctus scelerisque dignissim, nibh bibendum, interdum eleifend tempus, volutpat."
personal,51,Dallas,Technology,Somewhat dissatisfied,Ipsum fermentum. Nunc massa eros leo scelerisque et duis eleifend pellentesque dolor. Justo pellentesque odio.
personal,61,Dallas,Technology,Somewhat dissatisfied,Montes erat non viverra donec vehicula! Elit leo dolor laoreet arcu dictumst.
personal,70,Dallas,Technology,Neither satisfied nor dissatisfied,"Pharetra gravida platea ante purus, montes risus dignissim commodo pharetra non tortor."
personal,91,Austin,Government Services,Somewhat dissatisfied,Tellus eros! Lacus at. Consequat culpa donec nullam iaculis nulla bibendum rutrum metus orci.
personal,18,Dallas,Technology,Somewhat satisfied,Praesent integer magna! Lectus suspendisse sollicitudin dignissim facilisis dui tellus orci? Rutrum curabitur.
personal,84,Austin,Technology,Extremely satisfied,"Mi sapien eget temporibus luctus? Fusce, ultricies massa mauris vehicula nibh? Vivamus arcu."
personal,70,Houston,Government Services,Extremely satisfied,Integer sodales sagittis ante ligula vestibulum facilisi ab iaculis eu. Phasellus elit maecenas.
personal,93,San Antonio,Consulting,Extremely satisfied,Iaculis vitae risus rhoncus sem! Rutrum ipsum sodales accumsan culpa.
personal,35,San Antonio,Government Services,Extremely dissatisfied,"Suspendisse atque tempus ac? Placerat elit vitae est bibendum felis, malesuada luctus ullamcorper tortor lectus."
personal,52,Houston,Technology,Extremely dissatisfied,"Eget pede sapien fringilla. Amet egestas cursus, et! Luctus integer."
personal,91,Austin,Government Services,Extremely satisfied,Duis! Orci eros sagittis lorem duis amet? Suspendisse. Tincidunt elementum.
personal,58,Fort Worth,Government Services,Neither satisfied nor dissatisfied,"Neque placerat porta. Quam posuere morbi? Auctor placerat, risus turpis."
personal,43,Dallas,Healthcare,Neither satisfied nor dissatisfied,"Neque enim. Aliquam aliquam elementum lectus. Donec leo elit? Facilisis, ultricies."
personal,94,Houston,Government Services,Somewhat satisfied,Integer eros tempora faucibus gravida primis pretium ligula. Auctor volutpat.
personal,70,San Antonio,Technology,Somewhat dissatisfied,Diam venenatis imperdiet ultricies viverra! Ultricies? Venenatis faucibus eu commodo culpa viverra tortor dolorem.
personal,47,Fort Worth,Energy,Extremely dissatisfied,Fringilla eu ipsum duis. Sem ante aenean nibh mi tempor imperdiet sagittis vitae.
personal,75,Houston,Consulting,Extremely dissatisfied,Vestibulum morbi? Ligula? Porttitor pretium culpa ligula iaculis id temporibus dictumst. Elit quam eu diam.
personal,21,Dallas,Consulting,Extremely dissatisfied,Tempus nibh rhoncus leo sodales aliquet elementum augue egestas in vivamus nibh dapibus.
personal,22,Austin,Energy,Somewhat dissatisfied,Iaculis phasellus montes molestie montes pede? Cursus vel tortor integer wisi! Elementum nulla euismod.
personal,49,Dallas,Government Services,Somewhat satisfied,Elementum? Magnis auctor quam accusamus orci molestie fringilla enim lorem interdum.
personal,77,Fort Worth,Technology,Neither satisfied nor dissatisfied,Curabitur ipsum sem duis gravida nibh primis aliquet. Mi laoreet.
personal,91,Austin,Technology,Extremely satisfied,Consectetuer ut fringilla eros eros vel porttitor et. Suspendisse sodales. Lorem? Scelerisque scelerisque faucibus.
personal,51,Austin,Healthcare,Neither satisfied nor dissatisfied,Suscipit dictumst per facilisi pellentesque urna. Maecenas pede ligula metus arcu.
personal,41,San Antonio,Government Services,Extremely dissatisfied,Felis? Ante morbi! Eu justo eleifend non pede? Placerat fringilla dui est mi diam.
personal,89,San Antonio,Technology,Somewhat satisfied,Fermentum orci nunc augue. Dignissim purus. Consectetuer aliquet auctor dolor.
personal,44,Austin,Energy,Neither satisfied nor dissatisfied,"Aenean dolorem. Platea? Pharetra, et phasellus eu odio at, amet rutrum imperdiet vel."
personal,94,Austin,Healthcare,Extremely dissatisfied,"Vivamus magnis, purus lacus in urna culpa turpis pharetra eget montes."
personal,40,Austin,Consulting,Extremely satisfied,"Orci faucibus porta nullam vivamus aliquam metus non? A, ab ab, elit in. Platea."
personal,66,Houston,Healthcare,Extremely dissatisfied,Magna massa. Fringilla rutrum at nullam? Laoreet temporibus pharetra cras vestibulum phasellus pretium sollicitudin praesent.
personal,37,Dallas,Government Services,Somewhat dissatisfied,Pellentesque tempus. Dapibus odio? Bibendum tempor quis montes euismod vulputate suscipit tellus facilisis.
personal,98,Houston,Government Services,Somewhat dissatisfied,Curabitur purus duis lacus a elit eros lorem aliquet in dapibus wisi rhoncus metus.
personal,68,Austin,Healthcare,Extremely satisfied,Ut sagittis tempus risus mi pharetra gravida. Natoque enim tincidunt mattis pharetra at eu.
personal,61,Austin,Technology,Neither satisfied nor dissatisfied,Montes ut orci metus consectetuer. Nunc posuere scelerisque! Eu enim. Eros.
personal,41,Austin,Consulting,Extremely dissatisfied,"Sagittis turpis imperdiet, dolorem praesent et in orci convallis vulputate diam fusce porttitor culpa non."
personal,19,Dallas,Government Services,Somewhat satisfied,Rutrum ultricies! Mi arcu vestibulum fermentum ante ligula urna. Accumsan fermentum orci.
personal,40,Houston,Energy,Somewhat dissatisfied,"Metus ridiculus in proin lorem platea fusce, malesuada! Primis vulputate felis tempus? Aliquet diam? Magna."
personal,53,San Antonio,Technology,Extremely satisfied,"Porta ante phasellus quis, lorem erat per tempor, sollicitudin accumsan at. Interdum a."
personal,67,Fort Worth,Consulting,Somewhat dissatisfied,Accumsan mauris! Consectetuer cursus porta molestie vestibulum wisi montes per wisi eu gravida auctor.
personal,83,San Antonio,Healthcare,Extremely satisfied,Amet metus facilisi! Ut sapien enim integer maecenas montes primis curabitur. Temporibus egestas amet.
personal,48,Austin,Healthcare,Extremely satisfied,Dolorem? Tempora auctor diam felis est amet! Tellus ac nunc quam dictumst facilisi natoque.
personal,68,Fort Worth,Energy,Neither satisfied nor dissatisfied,Potenti gravida vitae dictumst ac accusamus ante. Ultrices aliquam eget? Justo.
personal,39,Fort Worth,Energy,Somewhat satisfied,Pede amet vulputate risus venenatis porta nec vel massa maecenas ultrices.
personal,26,San Antonio,Healthcare,Extremely dissatisfied,"At sem metus cursus etiam accusamus, luctus cursus viverra tempus."
personal,91,Austin,Technology,Neither satisfied nor dissatisfied,Et ultricies tellus sit morbi convallis! Leo arcu iaculis ipsum potenti vehicula nunc nulla a.
personal,42,Dallas,Consulting,Somewhat satisfied,"Arcu, et platea sagittis ullamcorper arcu leo! Tellus posuere volutpat vehicula non proin temporibus non."
personal,41,Fort Worth,Energy,Extremely satisfied,Consequat fringilla purus. Vulputate! Diam dolorem sapien sed a at? Egestas eros. Dolor tempor.
personal,24,Fort Worth,Energy,Neither satisfied nor dissatisfied,Odio massa temporibus sapien commodo viverra sit dolor dictumst atque accumsan egestas in.
personal,40,San Antonio,Healthcare,Somewhat dissatisfied,"Mattis fringilla wisi quam rutrum tortor ultrices felis sit ultricies accumsan cras quis, eget? Auctor."
personal,75,Houston,Energy,Somewhat dissatisfied,"Duis ultrices nibh wisi arcu ut cras amet eget nullam, ullamcorper imperdiet magna tincidunt."
personal,51,Houston,Technology,Somewhat satisfied,"Sit aliquam fusce sollicitudin odio arcu ullamcorper est odio, sodales! Aliquam ac elit."
personal,61,Houston,Healthcare,Extremely satisfied,Culpa posuere blandit. Suspendisse morbi eros viverra! Mi nonummy laoreet placerat odio.
personal,75,Fort Worth,Technology,Neither satisfied nor dissatisfied,Risus convallis sed ligula vehicula ullamcorper enim imperdiet erat dui arcu tempora. Proin suspendisse.
personal,19,Fort Worth,Technology,Somewhat satisfied,Auctor malesuada tortor leo at luctus nibh. Et donec dapibus scelerisque tempus dapibus.
personal,84,Fort Worth,Energy,Somewhat dissatisfied,Neque sodales facilisi platea. Ridiculus egestas non natoque morbi? Pede et facilisi scelerisque faucibus? Sagittis.
personal,68,San Antonio,Government Services,Somewhat satisfied,"Imperdiet cras. Est, cursus lorem commodo metus proin, fringilla orci. Ultrices sit culpa."
personal,33,Dallas,Government Services,Neither satisfied nor dissatisfied,Ante ridiculus sit sagittis blandit per magna. Metus tempor donec tortor? Vulputate bibendum.
personal,32,Austin,Healthcare,Somewhat satisfied,"Velit quam elit. Gravida aliquam est neque, ridiculus interdum faucibus natoque volutpat ipsum, cursus."
personal,21,San Antonio,Technology,Extremely satisfied,Integer a in vehicula purus arcu sit pellentesque nullam turpis vestibulum sodales sodales nullam.
personal,31,Houston,Energy,Somewhat dissatisfied,Culpa! Quam tempora turpis tortor imperdiet felis pretium tempor eros potenti.
personal,60,Houston,Government Services,Somewhat satisfied,"Consequat. Interdum sit bibendum imperdiet duis, nunc! Nonummy! Pharetra faucibus tellus egestas. Placerat."
personal,29,Austin,Government Services,Somewhat dissatisfied,"Eget aliquet turpis risus suscipit tempus. Erat egestas a praesent, non."
personal,23,Houston,Government Services,Extremely satisfied,Eu sapien. Orci arcu diam rutrum luctus augue turpis primis vestibulum gravida nec interdum.
personal,62,San Antonio,Technology,Neither satisfied nor dissatisfied,Purus lectus maecenas ante tempora velit viverra platea sodales. Nullam diam. Ante nulla fringilla.
personal,52,Dallas,Government Services,Somewhat satisfied,Ridiculus morbi odio duis ultrices ultricies faucibus pede nonummy magna ipsum et. At.
personal,59,Fort Worth,Energy,Somewhat satisfied,Sapien fermentum proin duis nibh posuere massa atque iaculis sit.
personal,68,San Antonio,Government Services,Somewhat dissatisfied,Ipsum volutpat dolorem vivamus sapien rutrum accumsan magna scelerisque eget.
personal,81,Houston,Government Services,Extremely dissatisfied,"Nibh dolor aenean magna, justo aenean blandit ab enim ante."
personal,86,Houston,Energy,Extremely satisfied,"Praesent. Accusamus, eros erat, ridiculus, aliquet duis aliquam sollicitudin primis vehicula neque est arcu pede."
personal,92,Fort Worth,Healthcare,Somewhat satisfied,Nonummy praesent eros faucibus lectus scelerisque auctor. Urna vulputate suspendisse sit! Dapibus.
personal,61,Austin,Government Services,Extremely dissatisfied,"Malesuada mi interdum. Mi dui sagittis ante erat? Maecenas. Elementum est magna ac, luctus ridiculus."
personal,73,Austin,Energy,Somewhat dissatisfied,Dictumst scelerisque suspendisse. Rhoncus non platea euismod etiam etiam. Elementum.
personal,34,Dallas,Government Services,Somewhat dissatisfied,"Sed volutpat cursus ullamcorper? Facilisis suspendisse, at scelerisque aenean pretium et, diam."
personal,75,Fort Worth,Government Services,Extremely dissatisfied,Arcu atque sem fermentum! Nibh platea pede massa. Risus enim. Massa ac donec.
personal,78,Austin,Healthcare,Extremely dissatisfied,Venenatis tempor diam. Facilisis. Dictumst facilisis? Potenti dapibus rutrum! Malesuada sit lectus! Dolor.
personal,93,Dallas,Healthcare,Somewhat dissatisfied,Tincidunt aenean. Sodales nonummy nullam metus et scelerisque ridiculus sagittis dictumst.
personal,39,Fort Worth,Government Services,Extremely dissatisfied,Elit nibh fermentum. Imperdiet ultricies non placerat molestie platea viverra. Mattis risus! Neque.
personal,25,Dallas,Technology,Somewhat dissatisfied,"Cursus commodo fusce wisi facilisis, accumsan maecenas gravida in gravida platea diam."
personal,57,Fort Worth,Consulting,Neither satisfied nor dissatisfied,Rutrum donec integer neque metus mi? Erat dolorem nulla erat.
personal,94,San Antonio,Energy,Extremely satisfied,"Mi accusamus proin, dui ullamcorper facilisi natoque facilisis! Eros cras."
personal,79,Austin,Healthcare,Extremely dissatisfied,Lacus ullamcorper potenti pellentesque justo dapibus vivamus vestibulum ab viverra atque ligula mi praesent.
personal,94,San Antonio,Energy,Extremely satisfied,Iaculis nonummy. Cursus leo sapien eros morbi dolor quam dolorem maecenas ac ut.
personal,92,Houston,Consulting,Extremely satisfied,"Aenean ab ullamcorper vulputate, quam, vitae wisi temporibus amet massa? Aliquet! Temporibus."
personal,75,Austin,Technology,Extremely dissatisfied,Tellus ligula velit erat aliquam enim egestas nibh. Dictumst natoque.
personal,70,Austin,Technology,Extremely satisfied,Eget lacus cras nulla malesuada ultrices amet id sagittis ridiculus.
personal,43,Austin,Healthcare,Somewhat dissatisfied,"Gravida morbi venenatis metus potenti luctus tempora urna metus, consectetuer. Porta suspendisse."
personal,80,Dallas,Technology,Extremely dissatisfied,"Ultrices. Mattis et ultrices, facilisi, porta imperdiet donec tempor ac."
personal,66,Fort Worth,Energy,Extremely satisfied,Commodo suscipit. Dignissim ante scelerisque lorem dapibus pellentesque cursus eleifend? Felis orci mi phasellus.
personal,62,Fort Worth,Technology,Somewhat dissatisfied,Scelerisque duis! Nunc arcu leo. Maecenas blandit euismod elit iaculis praesent nullam metus tellus curabitur.
personal,36,San Antonio,Government Services,Extremely satisfied,Ridiculus quis purus magnis elit est elit vehicula suscipit eros.
personal,32,San Antonio,Healthcare,Somewhat satisfied,"Pharetra. Malesuada arcu? Scelerisque enim? Magnis culpa nibh, metus tellus a porttitor enim potenti."
personal,87,Dallas,Government Services,Somewhat satisfied,Sed. Rhoncus malesuada laoreet. Pharetra? Tempus dapibus potenti justo ultricies. Scelerisque bibendum. Wisi.
personal,31,San Antonio,Technology,Neither satisfied nor dissatisfied,"Purus phasellus facilisis. Platea. Fringilla, at ligula pede enim! Praesent! Luctus suspendisse vehicula elementum."
personal,44,Fort Worth,Government Services,Extremely dissatisfied,"Odio dapibus, luctus venenatis est neque duis amet! Ipsum, diam augue."
personal,75,Fort Worth,Healthcare,Extremely satisfied,Blandit molestie aliquet morbi augue enim mattis? Dolorem! At! Mattis risus? Eros potenti.
personal,63,Dallas,Government Services,Somewhat dissatisfied,Vivamus faucibus tempus. Placerat tempora vestibulum? Gravida metus massa. Culpa molestie.
personal,93,Dallas,Healthcare,Extremely satisfied,Dictumst fringilla ultrices ridiculus sem quam turpis pellentesque suspendisse accumsan platea! A rhoncus lorem metus.
personal,90,San Antonio,Healthcare,Somewhat satisfied,Fusce tellus ridiculus ac viverra ridiculus? Posuere ultrices porttitor est nullam elementum auctor.
personal,86,Austin,Government Services,Somewhat satisfied,"Nunc pharetra pellentesque euismod faucibus id neque, facilisis eleifend. Tempora vitae sagittis."
personal,72,Houston,Energy,Extremely satisfied,"Egestas euismod consectetuer, lorem elit imperdiet sit wisi purus aenean."
personal,69,Houston,Government Services,Neither satisfied nor dissatisfied,Amet? Posuere neque bibendum vel! Cras ultrices volutpat arcu est.
personal,98,San Antonio,Consulting,Somewhat dissatisfied,Quam lorem sollicitudin? Potenti id ut! Ridiculus quam per dictumst accumsan malesuada turpis.
personal,20,Dallas,Government Services,Somewhat satisfied,Natoque fusce sagittis volutpat. Interdum? Commodo tempor convallis lacus nonummy vitae.
personal,75,Fort Worth,Consulting,Neither satisfied nor dissatisfied,"Ullamcorper sem tempor porta dolorem suscipit eleifend curabitur tempora scelerisque, orci per rutrum et vestibulum."
personal,40,Austin,Energy,Neither satisfied nor dissatisfied,Interdum blandit ullamcorper enim leo vestibulum! Porttitor? Laoreet ultrices euismod praesent convallis consectetuer.
personal,24,Fort Worth,Healthcare,Extremely dissatisfied,Ante vehicula? Faucibus? Dictumst? Nunc dolor lorem neque nullam per potenti.
personal,55,Fort Worth,Technology,Somewhat dissatisfied,"Pretium proin duis pretium nullam montes magnis praesent, ullamcorper pellentesque suspendisse."
personal,35,Fort Worth,Consulting,Somewhat dissatisfied,Quis odio culpa placerat mauris per atque fusce sagittis praesent.
personal,62,Fort Worth,Government Services,Somewhat satisfied,Nulla pellentesque tellus auctor. Fermentum eleifend enim tincidunt nonummy ut sapien? Mauris. Tempora magnis.
personal,61,Austin,Government Services,Extremely dissatisfied,"Pretium aenean phasellus etiam lacus dapibus curabitur. Mattis faucibus? Fusce, venenatis."
personal,47,San Antonio,Healthcare,Neither satisfied nor dissatisfied,Per leo elementum ligula cras accumsan non praesent ab ligula.
personal,70,San Antonio,Consulting,Extremely satisfied,Eleifend tincidunt ut fringilla tincidunt interdum ligula amet eget potenti faucibus montes vulputate pretium.
personal,76,Fort Worth,Healthcare,Somewhat dissatisfied,Primis venenatis laoreet consequat convallis vulputate sed gravida pellentesque vulputate potenti. Praesent dignissim.
personal,85,Austin,Technology,Somewhat dissatisfied,"Diam ridiculus, dictumst ut! Rutrum ultrices potenti facilisis mauris orci diam accusamus lacus risus! Leo."
personal,39,San Antonio,Energy,Extremely dissatisfied,Tellus. Atque dolorem at vulputate tortor pharetra! Viverra vel volutpat eros.
personal,60,Fort Worth,Government Services,Somewhat satisfied,Montes! Id magna fringilla duis natoque convallis augue. Tincidunt. Posuere dictumst dolor.
personal,51,Dallas,Technology,Extremely satisfied,Egestas tempus cursus fusce? Tellus. Eu magna et. Sapien nullam.
personal,70,San Antonio,Technology,Somewhat dissatisfied,Imperdiet dapibus id pharetra amet atque enim. Est in dui odio maecenas ultricies. Lorem.
personal,51,Dallas,Technology,Extremely dissatisfied,Non? Sit per interdum leo atque euismod eleifend. Diam sem quis sodales arcu dolor in.
personal,66,Dallas,Energy,Somewhat dissatisfied,"In id, eu. Wisi. Massa bibendum vel. Rhoncus laoreet! Massa potenti purus. Temporibus faucibus."
personal,41,San Antonio,Technology,Extremely satisfied,"Proin felis tempus suspendisse iaculis est vehicula vel odio porta sit magnis facilisis, montes a."
personal,48,Houston,Technology,Extremely satisfied,Id sodales vel placerat sagittis tempus risus sollicitudin tempus scelerisque. Integer nulla odio vel! Tempor.
personal,24,San Antonio,Energy,Somewhat satisfied,Integer ante proin cursus nullam magnis nec. Molestie sed sed pellentesque.
personal,71,San Antonio,Government Services,Somewhat dissatisfied,Porttitor duis viverra velit urna ipsum donec metus consectetuer? Placerat duis urna.
personal,24,San Antonio,Energy,Neither satisfied nor dissatisfied,"Dignissim malesuada in dolorem. Tellus risus, gravida, rhoncus nec id consectetuer. Cras? Wisi."
personal,67,San Antonio,Healthcare,Somewhat dissatisfied,Vel risus. Natoque dictumst velit quam mi! Curabitur bibendum tortor.
personal,62,San Antonio,Technology,Neither satisfied nor dissatisfied,"Ultrices vivamus fusce massa, quam? Lacus mauris ridiculus? Mattis enim imperdiet."
personal,26,San Antonio,Technology,Somewhat satisfied,Massa? Bibendum venenatis elit lacus a pellentesque lectus magna magnis augue.
personal,53,Austin,Technology,Extremely dissatisfied,Viverra convallis velit arcu tortor metus etiam lacus? Egestas vulputate.
personal,41,Austin,Government Services,Neither satisfied nor dissatisfied,Aliquam proin porttitor! Euismod quis pede pharetra phasellus nullam eleifend maecenas posuere? Facilisis.
personal,75,Fort Worth,Energy,Somewhat satisfied,"Quam magnis quam dictumst ullamcorper mi duis? Eu! At, et."
personal,70,Houston,Government Services,Neither satisfied nor dissatisfied,"Gravida venenatis tellus integer morbi fermentum vitae, platea posuere convallis phasellus."
personal,50,Fort Worth,Technology,Somewhat satisfied,Rutrum gravida molestie rutrum morbi. Commodo urna facilisi in sodales.
personal,83,San Antonio,Consulting,Extremely dissatisfied,Accumsan ante dui luctus pretium gravida laoreet dolorem. Nec interdum.
personal,48,Austin,Healthcare,Somewhat dissatisfied,Pretium lacus potenti. Atque tincidunt dolor ab venenatis ab fermentum.
personal,52,Fort Worth,Consulting,Somewhat satisfied,"Interdum magnis placerat pharetra non imperdiet ultricies facilisi accusamus consectetuer, orci dictumst cras."
personal,53,Austin,Consulting,Extremely dissatisfied,Neque dignissim dui dictumst pretium facilisi proin? Lacus convallis elit cras venenatis tortor? Culpa.
personal,43,Dallas,Healthcare,Extremely dissatisfied,Praesent. Rutrum aenean pede sapien natoque pede elementum praesent ridiculus tortor.
