survey_name,Q1,Q2,Q3,Q4,Q5
personal,93,Fort Worth,Government Services,Neither satisfied nor dissatisfied,In neque vehicula nibh! Eleifend ipsum rutrum primis! Ultrices iaculis suscipit ridiculus. Blandit.
personal,24,Dallas,Consulting,Neither satisfied nor dissatisfied,Scelerisque magnis! Dignissim leo praesent. Mattis? Sapien accusamus risus volutpat platea. Facilisis.
personal,74,San Antonio,Government Services,Extremely satisfied,Ac volutpat praesent rhoncus platea neque dignissim. Cursus elit eget vivamus nullam.
personal,31,Houston,Energy,Somewhat satisfied,Sit id mattis viverra tempus risus cursus placerat metus dolorem mauris phasellus tempora.
personal,65,Dallas,Government Services,Neither satisfied nor dissatisfied,Blandit in auctor? Eu faucibus at mi enim. In natoque.
personal,61,Austin,Consulting,Neither satisfied nor dissatisfied,Fringilla vel proin imperdiet aenean! Augue? Nec cras lorem eu ultrices nonummy magna lectus.
personal,92,San Antonio,Healthcare,Extremely dissatisfied,"Suspendisse ac metus, elementum magna nec. Tellus id ridiculus. Tellus vulputate sem atque. Phasellus porta."
personal,34,Fort Worth,Technology,Somewhat dissatisfied,Tempus consectetuer ultricies nibh aliquet placerat ut. Per vivamus sem sodales.
personal,89,Houston,Healthcare,Somewhat satisfied,Suspendisse ante. Velit dignissim phasellus. Nibh accumsan erat leo aliquet non justo! Culpa dictumst curabitur.
personal,95,San Antonio,Technology,Somewhat satisfied,"Mattis convallis. Vestibulum per ridiculus, odio rutrum. Facilisis. In phasellus laoreet metus primis turpis vel."
personal,39,San Antonio,Consulting,Somewhat dissatisfied,Tempus sit ante vivamus accusamus dolor nibh orci rutrum lacus.
personal,53,Fort Worth,Government Services,Somewhat satisfied,Purus. Nullam sem wisi sed. Cras purus posuere accumsan vivamus.
personal,52,San Antonio,Energy,Somewhat dissatisfied,"Massa potenti tempus tempus. Fusce vitae laoreet, ridiculus sem sit culpa."
personal,33,Houston,Technology,Somewhat satisfied,Gravida temporibus lacus fusce lorem? Sollicitudin egestas leo luctus. Cras mattis tortor.
personal,81,Houston,Healthcare,Somewhat dissatisfied,Tincidunt primis. Consequat facilisis platea fusce tincidunt? Est elementum bibendum. Placerat ultricies vitae. Ab per.
personal,29,Fort Worth,Healthcare,Extremely satisfied,Et suspendisse? Est velit aenean vitae dolor dolorem aliquet pede.
personal,86,Fort Worth,Energy,Extremely satisfied,Urna dictumst est tortor enim? Fusce molestie mi sed accusamus eget.
personal,40,Austin,Healthcare,Somewhat satisfied,Sit lacus cursus nibh erat ligula. Velit lorem? Molestie pellentesque proin.
personal,26,Houston,Healthcare,Extremely dissatisfied,Ultricies non? Placerat. Eget ridiculus natoque euismod posuere. Magna elementum ab vitae. Magna at.
personal,57,Fort Worth,Healthcare,Extremely dissatisfied,Cras dui suspendisse praesent accusamus. Wisi velit! Atque id mattis est eleifend.
personal,89,Houston,Technology,Extremely dissatisfied,Porta id odio augue. Tellus rutrum! Proin urna sodales bibendum magnis. Nonummy commodo.
personal,57,Austin,Healthcare,Extremely satisfied,Auctor eget rhoncus. Tellus velit non est tortor ut ac.
personal,86,Dallas,Consulting,Neither satisfied nor dissatisfied,Odio in. Pharetra accumsan etiam pellentesque nunc imperdiet mi. Sapien.
personal,68,Fort Worth,Technology,Somewhat satisfied,Quis cras? Mauris porttitor? Pretium scelerisque per cursus. Posuere amet bibendum in.
personal,65,Austin,Government Services,Somewhat dissatisfied,"Aliquam enim velit auctor. Erat? Aenean quis faucibus lacus, scelerisque! Elit."
personal,54,Dallas,Technology,Extremely satisfied,"Ab vulputate? Nec potenti suspendisse tempora elementum fermentum suspendisse auctor proin vehicula, duis odio porttitor."
personal,32,Dallas,Energy,Somewhat satisfied,Pretium consectetuer enim cursus eu platea tellus orci eros risus temporibus mattis.
personal,62,Dallas,Government Services,Extremely satisfied,Ridiculus. Tincidunt ligula magna neque suspendisse blandit quam gravida! Facilisi orci dolorem? Sit? Justo mi.
personal,92,Dallas,Consulting,Neither satisfied nor dissatisfied,Malesuada dignissim curabitur quam montes! Ac leo purus. Imperdiet tempor morbi.
personal,80,Dallas,Government Services,Extremely dissatisfied,Tempora augue luctus dui potenti dui. Potenti duis montes dui lacus. Primis purus.
personal,100,Fort Worth,Consulting,Somewhat satisfied,Magna. Mauris tincidunt elementum facilisi culpa aenean magna. Blandit accusamus scelerisque posuere ab fermentum accusamus.
personal,82,Dallas,Healthcare,Extremely satisfied,Faucibus vehicula vulputate facilisis luctus consectetuer. Sollicitudin sed ipsum tortor. Egestas.
personal,55,Dallas,Government Services,Neither satisfied nor dissatisfied,Amet ut platea vehicula orci at id atque urna! Primis enim augue.
personal,78,Austin,Consulting,Somewhat satisfied,Laoreet tellus sed. Massa. Felis in phasellus nibh wisi primis. Accumsan erat. Erat.
personal,66,Dallas,Government Services,Neither satisfied nor dissatisfied,Atque! Venenatis amet blandit vehicula malesuada sodales. Cras tincidunt. Odio massa sodales molestie malesuada interdum.
personal,46,Houston,Energy,Extremely dissatisfied,Vulputate et ante. Integer aliquet lectus! Eros magnis fusce. Volutpat. Laoreet. Est neque nulla.
personal,39,Houston,Consulting,Somewhat satisfied,Pellentesque. Vulputate cras scelerisque fringilla dui eget aenean nunc malesuada lacus tincidunt augue eros.
personal,52,Houston,Technology,Somewhat satisfied,Cursus rhoncus? Platea praesent? Consequat? Lorem non? Gravida? Duis? Sapien! Eu vel morbi elementum.
personal,80,Fort Worth,Healthcare,Neither satisfied nor dissatisfied,"Per lectus praesent eros arcu purus. Vel, ultrices vulputate. Nullam."
personal,76,Dallas,Government Services,Somewhat dissatisfied,Convallis viverra. Suspendisse accusamus augue venenatis purus nibh elementum scelerisque etiam dui? Tempora.
personal,98,Fort Worth,Technology,Somewhat dissatisfied,Sit augue ultrices. Sem nonummy velit massa elit mi. Curabitur.
personal,29,San Antonio,Government Services,Somewhat satisfied,"Enim quam. Urna. Maecenas? Sollicitudin. Faucibus, nulla arcu neque? Nulla aliquet est? Vivamus."
personal,62,Dallas,Technology,Somewhat satisfied,"Convallis, etiam consectetuer in potenti aliquet tellus pede convallis velit."
personal,54,San Antonio,Consulting,Somewhat dissatisfied,"Ac aenean justo. Aliquet mi? Lacus vestibulum id euismod sollicitudin, eleifend quam elementum urna."
personal,49,Fort Worth,Technology,Extremely satisfied,Donec cras maecenas montes! Orci facilisis ipsum integer. Augue. Posuere.
personal,20,Austin,Government Services,Somewhat satisfied,Porta temporibus tempus interdum sodales ullamcorper amet. At pede tempora gravida.
personal,34,Dallas,Energy,Neither satisfied nor dissatisfied,Lectus interdum felis vel mauris enim consectetuer sollicitudin proin enim ligula sed molestie.
personal,70,Austin,Consulting,Somewhat dissatisfied,Dolor tortor posuere scelerisque lectus non pellentesque. Primis eros consectetuer egestas felis.
personal,91,San Antonio,Energy,Neither satisfied nor dissatisfied,"Vel et? Nibh, fusce sem aliquam arcu vestibulum faucibus fermentum."
personal,33,Houston,Healthcare,Extremely dissatisfied,"Morbi laoreet nibh arcu? Cras mi, quis. Viverra ab vivamus lectus."
personal,29,San Antonio,Consulting,Neither satisfied nor dissatisfied,Magnis? Platea consequat erat phasellus nullam suscipit. Sit faucibus. Est culpa amet.
personal,43,San Antonio,Technology,Somewhat satisfied,Ridiculus facilisis phasellus iaculis vitae egestas nec magnis placerat faucibus elit. Accusamus.
personal,29,Dallas,Government Services,Somewhat satisfied,Euismod et. Nunc temporibus pede molestie risus elit eu eleifend. Fusce. Sit.
personal,61,Houston,Energy,Extremely satisfied,Aliquam ipsum! Potenti. Cursus imperdiet quis ante praesent laoreet duis dolor.
personal,89,Houston,Energy,Somewhat dissatisfied,"Elementum gravida, porta duis ligula maecenas dui consequat nulla platea! Venenatis nec enim vestibulum integer."
personal,96,Austin,Energy,Somewhat dissatisfied,At phasellus augue vivamus nec? Venenatis. Odio amet! Cursus vehicula pharetra.
personal,21,Austin,Government Services,Neither satisfied nor dissatisfied,Sapien. Enim morbi leo tempor erat! Ultricies cras dapibus? Montes purus nonummy praesent.
personal,95,San Antonio,Consulting,Somewhat satisfied,Faucibus fermentum donec est diam! Wisi convallis quis porttitor ridiculus ac.
personal,27,Dallas,Consulting,Somewhat dissatisfied,Purus non purus natoque iaculis. Dapibus ultrices rhoncus aenean lectus blandit aliquet venenatis.
personal,96,Dallas,Consulting,Somewhat dissatisfied,"Gravida vitae pellentesque massa, sit sit quam, auctor etiam diam. Consequat. Vel at tortor sollicitudin."
personal,54,Austin,Consulting,Neither satisfied nor dissatisfied,Gravida ridiculus nonummy commodo cursus maecenas! Lorem etiam vivamus aenean nulla purus.
personal,73,Fort Worth,Energy,Extremely dissatisfied,"Sollicitudin! Lacus. Id non nec! Cras consectetuer magnis duis, et."
personal,47,Houston,Technology,Somewhat dissatisfied,"Etiam sagittis, fringilla. Nonummy. Suscipit. Sagittis dapibus tempora suscipit ab dapibus aliquam."
personal,98,Austin,Energy,Somewhat dissatisfied,Ipsum? Proin. Dapibus ultricies ac aliquam praesent? Commodo accumsan culpa sodales arcu ab.
personal,47,Dallas,Government Services,Somewhat satisfied,Proin dapibus blandit diam non per aliquet? Faucibus blandit tempor ipsum lacus augue.
personal,25,Austin,Government Services,Somewhat satisfied,"Sapien, iaculis atque malesuada. Mauris posuere ab donec. Eleifend praesent nulla eu ullamcorper."
personal,84,Austin,Consulting,Somewhat satisfied,Montes tortor in fusce ullamcorper sem! Suspendisse platea venenatis posuere ultricies? Rhoncus ridiculus mi.
personal,34,San Antonio,Healthcare,Extremely dissatisfied,Orci tempus vivamus accusamus est consectetuer magna tempora posuere orci aliquam duis. Cursus fermentum.
personal,85,Fort Worth,Healthcare,Extremely dissatisfied,Imperdiet suscipit gravida turpis placerat integer. Tellus tortor. Volutpat lacus platea! Magnis.
personal,29,Houston,Energy,Somewhat satisfied,Sit placerat. Sollicitudin! Quis dapibus tempus maecenas dolorem donec dapibus laoreet malesuada molestie ac massa.
personal,45,Dallas,Healthcare,Extremely satisfied,"Interdum! Porta dolorem, ab luctus ultricies aliquam egestas bibendum a culpa? Neque. Molestie convallis phasellus."
personal,24,San Antonio,Government Services,Extremely satisfied,Venenatis. Magna phasellus metus massa. Sed ab laoreet donec magnis magna porta consequat.
personal,89,Austin,Healthcare,Somewhat dissatisfied,Consequat amet tempor consectetuer cursus? Ridiculus euismod aliquam aenean lacus.
personal,71,San Antonio,Technology,Somewhat satisfied,Culpa venenatis magna atque? Quam mauris sit est ipsum ligula volutpat tellus aenean.
personal,81,Austin,Technology,Somewhat dissatisfied,Atque leo nulla culpa orci id dolorem ac euismod id cursus ultricies auctor augue. In.
personal,61,San Antonio,Energy,Neither satisfied nor dissatisfied,"Cursus lectus lacus euismod pretium eleifend, vestibulum? Convallis iaculis? Curabitur. Maecenas turpis."
personal,29,Fort Worth,Energy,Extremely satisfied,Convallis amet vehicula vivamus elementum a neque? Metus! Lectus molestie.
personal,56,Houston,Government Services,Neither satisfied nor dissatisfied,Luctus dapibus aenean. Sed auctor nec curabitur purus sodales! Culpa arcu.
personal,53,Houston,Technology,Extremely dissatisfied,Elementum urna temporibus vel ut elementum! Viverra platea? A temporibus. Quam ac per.
personal,37,Dallas,Government Services,Somewhat dissatisfied,Ipsum pretium donec rhoncus arcu pharetra atque. Accusamus. Donec mattis placerat.
personal,97,Dallas,Energy,Somewhat dissatisfied,Vivamus ridiculus placerat wisi facilisis blandit lorem ultrices ultricies. Placerat ab erat dui.
personal,48,Dallas,Energy,Neither satisfied nor dissatisfied,"Nec dignissim sit? Metus. Quam dui ante atque, sodales mi cursus."
personal,25,San Antonio,Energy,Somewhat satisfied,Imperdiet! Elit mauris dolor magnis duis? Facilisi consequat nullam wisi.
personal,30,Fort Worth,Technology,Neither satisfied nor dissatisfied,Natoque laoreet euismod sagittis eget lacus aliquam pellentesque? Malesuada nibh mattis suscipit eros a.
personal,56,San Antonio,Consulting,Neither satisfied nor dissatisfied,Consectetuer aenean ligula ut rutrum cras culpa proin tempus vitae velit cras.
personal,48,Fort Worth,Technology,Somewhat satisfied,Auctor curabitur tincidunt luctus. Rhoncus montes nunc porta gravida ligula! Non aliquet ultrices id.
personal,83,Fort Worth,Technology,Extremely satisfied,"Gravida suscipit morbi nulla rhoncus? Ac, viverra egestas wisi a id."
personal,52,Austin,Government Services,Extremely satisfied,Est laoreet suspendisse eros eget morbi elit euismod vel suspendisse eleifend.
personal,19,Fort Worth,Consulting,Somewhat dissatisfied,"Magna faucibus arcu eu quam, elementum proin, pede est sollicitudin."
personal,28,San Antonio,Government Services,Extremely dissatisfied,Placerat quis aenean enim ultricies porttitor felis viverra pellentesque velit pellentesque ab mi iaculis.
personal,27,Houston,Energy,Somewhat dissatisfied,Dolorem facilisi malesuada nullam placerat tortor morbi cras tempus auctor! Ab pede.
personal,18,Dallas,Energy,Somewhat satisfied,Suscipit donec dictumst mattis. Pede eu eleifend dolor sit per amet montes.
personal,99,Fort Worth,Government Services,Somewhat satisfied,Pharetra. Amet sed leo culpa sapien dictumst porta pharetra. A curabitur ultrices placerat! Neque etiam.
personal,92,Fort Worth,Technology,Extremely dissatisfied,"Nec, mattis, quam turpis dictumst? Fusce ab temporibus vitae porta. Enim."
personal,88,Dallas,Government Services,Neither satisfied nor dissatisfied,"Ipsum accusamus molestie suspendisse volutpat accumsan velit, sem venenatis dapibus! Fringilla turpis wisi."
personal,76,Austin,Government Services,Neither satisfied nor dissatisfied,Porta vestibulum ipsum est culpa culpa est nulla pharetra molestie malesuada. In dolorem ridiculus.
personal,66,Houston,Consulting,Extremely satisfied,"Accusamus integer justo convallis, elit iaculis eros risus. Fringilla. Urna."
personal,70,Houston,Government Services,Somewhat satisfied,Sapien fringilla vulputate viverra fermentum sem pretium molestie pede suspendisse.
personal,61,Dallas,Government Services,Extremely dissatisfied,Rutrum placerat ab. Viverra rhoncus volutpat ultrices pretium leo purus in aenean dolorem dolor! Amet.
personal,87,Dallas,Technology,Extremely dissatisfied,Odio ut placerat primis ultricies. Gravida! Donec nulla luctus egestas lectus.
personal,76,Austin,Consulting,Extremely dissatisfied,Pharetra tempus velit suscipit turpis vulputate commodo cras pretium rutrum odio.
personal,50,Houston,Healthcare,Extremely dissatisfied,Consectetuer nullam platea elit mauris. Culpa sagittis eleifend. Accumsan nonummy ab convallis tempus posuere.
personal,81,Austin,Healthcare,Neither satisfied nor dissatisfied,Ultrices non est pellentesque metus elit. Nec suspendisse posuere imperdiet laoreet sapien curabitur.
personal,97,San Antonio,Healthcare,Somewhat satisfied,Elit lacus vestibulum rhoncus porttitor quam tempus urna a id ipsum.
personal,92,Houston,Government Services,Neither satisfied nor dissatisfied,"Mi facilisi egestas suscipit rutrum curabitur vulputate, volutpat rutrum eget non."
personal,94,San Antonio,Energy,Extremely dissatisfied,Consequat arcu vitae gravida! Est integer? Sollicitudin ridiculus arcu euismod diam volutpat.
personal,69,Dallas,Consulting,Somewhat satisfied,Rhoncus aliquet! Venenatis vehicula nibh quam morbi eu! Eros felis mi.
personal,42,Fort Worth,Consulting,Somewhat dissatisfied,Suspendisse fusce enim. Neque enim elit porttitor sapien! Suscipit aenean porta sit morbi.
personal,80,Fort Worth,Technology,Neither satisfied nor dissatisfied,Lacus per velit massa ullamcorper pretium. Proin scelerisque ac. Pede quam laoreet quam.
personal,78,San Antonio,Energy,Extremely dissatisfied,Volutpat proin. Eu nullam platea! Mi. Wisi porttitor volutpat vivamus sed! Vulputate vel eleifend ante.
personal,88,Dallas,Consulting,Somewhat satisfied,"Risus non arcu ligula mi, montes eros ipsum aenean ultrices? Commodo."
personal,81,San Antonio,Healthcare,Somewhat dissatisfied,"Morbi imperdiet bibendum turpis potenti rhoncus faucibus! Eu. Placerat molestie ut temporibus dignissim, tortor metus."
personal,19,Austin,Healthcare,Extremely dissatisfied,Enim vivamus dolor nec massa ipsum. Phasellus arcu est eros et viverra.
personal,75,San Antonio,Government Services,Somewhat dissatisfied,Lorem rhoncus augue! Urna. Ipsum! Mattis? Morbi auctor morbi? Per. Per accumsan.
personal,30,San Antonio,Technology,Extremely satisfied,Integer accumsan sapien luctus? Porttitor rutrum. Sagittis et vitae primis turpis lacus.
personal,68,San Antonio,Energy,Neither satisfied nor dissatisfied,"Neque cursus fringilla tempor arcu in tempora, curabitur tempor mauris consectetuer in facilisi justo per."
personal,72,Dallas,Government Services,Extremely satisfied,Elit suscipit sit quam ultrices interdum tincidunt aenean? Cursus dolor.
personal,78,Fort Worth,Consulting,Extremely satisfied,"Commodo tempora eget curabitur! Placerat orci duis natoque enim erat, eleifend donec, non."
personal,86,San Antonio,Consulting,Neither satisfied nor dissatisfied,"Auctor, dui consequat enim dapibus a? Ullamcorper odio? Eget! Ultrices platea nonummy."
personal,41,San Antonio,Government Services,Neither satisfied nor dissatisfied,"Ullamcorper proin ab aliquet eget ab? Magna est nibh sem, bibendum tortor."
personal,82,San Antonio,Government Services,Neither satisfied nor dissatisfied,"Sapien vehicula aenean nullam! Facilisi vitae elementum molestie pharetra curabitur tempus, dolorem porta ipsum aenean."
personal,90,Dallas,Energy,Neither satisfied nor dissatisfied,"Atque. Sagittis? Sagittis odio dui vitae eleifend! Aenean vehicula? Lacus blandit! Sit, ullamcorper lectus."
personal,20,San Antonio,Energy,Somewhat dissatisfied,Tincidunt. Est nibh in iaculis urna nonummy. Rhoncus accusamus quis duis urna.
personal,39,Dallas,Government Services,Neither satisfied nor dissatisfied,Diam. Per blandit vehicula lectus. Euismod. Lectus tempora nibh lectus.
personal,99,Austin,Energy,Neither satisfied nor dissatisfied,Purus culpa lorem. Volutpat suscipit pretium lacus placerat lectus nibh. Amet.
personal,95,Fort Worth,Technology,Extremely satisfied,"Dolorem at sagittis vitae, risus mi, aliquam orci bibendum wisi. Facilisi, magnis."
personal,77,Austin,Consulting,Extremely dissatisfied,Dignissim dui faucibus accumsan primis sapien elit pretium commodo vulputate pede iaculis rutrum.
personal,93,Austin,Government Services,Extremely satisfied,Interdum pede neque consectetuer nibh curabitur! Quis sapien integer. Ultricies nulla? Lorem.
personal,91,Fort Worth,Healthcare,Extremely dissatisfied,Commodo ultricies vulputate risus? Felis posuere luctus ante ullamcorper! Suspendisse neque suspendisse.
personal,57,Austin,Energy,Extremely satisfied,Ligula. Sapien mattis vitae aenean? Vulputate? Consectetuer ut? Purus? Viverra consectetuer. Porttitor.
personal,29,Houston,Consulting,Somewhat dissatisfied,Ut sapien augue. Facilisis ante elit facilisis augue massa dignissim etiam platea massa.
personal,27,Dallas,Healthcare,Neither satisfied nor dissatisfied,"Aliquet eleifend, egestas dapibus vivamus at eleifend, purus sodales interdum."
personal,86,San Antonio,Energy,Extremely satisfied,"Bibendum felis purus accusamus eget purus, augue pede duis potenti."
personal,88,Houston,Energy,Somewhat dissatisfied,In temporibus? Nonummy eros. Justo! Tellus volutpat magna enim platea non sem lacus cursus morbi.
personal,90,Houston,Government Services,Extremely satisfied,"Luctus consequat auctor non, accumsan accumsan dui luctus! Eleifend donec."
personal,96,Fort Worth,Energy,Somewhat satisfied,"Consequat neque! Donec? Rhoncus. Montes praesent vulputate tempus placerat dolor, urna pharetra."
personal,88,Dallas,Consulting,Extremely satisfied,"Integer venenatis iaculis lorem porttitor cras porttitor in pretium atque placerat pellentesque. Maecenas sollicitudin, porta."
personal,38,Dallas,Energy,Somewhat satisfied,Ultricies aenean egestas nunc suspendisse fusce eros ante vel a dolorem potenti? Duis suspendisse.
personal,95,Houston,Healthcare,Extremely dissatisfied,"Magnis venenatis sodales cras. Magnis nullam consectetuer, consequat. Interdum lacus. Turpis diam."
personal,100,San Antonio,Energy,Somewhat dissatisfied,Lectus egestas non amet laoreet. Nibh lacus. Fermentum nonummy ac.
personal,89,Houston,Technology,Somewhat satisfied,"Facilisis! Sagittis ullamcorper cursus vivamus facilisis eu velit suscipit auctor, interdum elit montes malesuada."
personal,76,Dallas,Energy,Extremely satisfied,"Dapibus suspendisse nullam, pretium maecenas! Augue maecenas eu purus nonummy accumsan."
personal,93,Dallas,Government Services,Neither satisfied nor dissatisfied,Sodales eleifend sed tortor sed nonummy aenean dignissim ipsum potenti.
personal,22,Austin,Energy,Extremely dissatisfied,"Vulputate malesuada tortor ut. Enim. Non? Imperdiet! Ipsum! Elementum mauris, accumsan."
personal,47,San Antonio,Consulting,Extremely satisfied,Auctor posuere rhoncus eros duis potenti proin per lacus aenean nullam magnis nunc.
personal,79,Houston,Healthcare,Extremely dissatisfied,Leo iaculis cursus. Nec! Ante. Non porttitor. Dictumst consectetuer egestas platea.
personal,39,San Antonio,Consulting,Somewhat satisfied,Culpa proin ligula ultricies sed suscipit praesent pede laoreet felis aliquet interdum.
personal,80,Fort Worth,Healthcare,Somewhat satisfied,"Ridiculus justo sagittis, iaculis rhoncus primis id, vitae. Quam id turpis."
personal,96,Dallas,Technology,Extremely satisfied,Pharetra quis integer neque porta sagittis elementum primis convallis elementum neque. Metus pretium sagittis? Wisi.
personal,33,Fort Worth,Consulting,Extremely satisfied,Ligula luctus ultricies? Sollicitudin venenatis? Sem? Natoque pellentesque scelerisque eu? Turpis.
personal,79,Houston,Healthcare,Somewhat satisfied,"Erat morbi mauris! Sollicitudin fusce odio? Mauris dictumst maecenas arcu! Tempor, sapien arcu? Blandit."
personal,34,Austin,Government Services,Neither satisfied nor dissatisfied,"Nullam curabitur lorem? Ac. Praesent, est, arcu ab turpis nonummy facilisi."
personal,27,Fort Worth,Government Services,Extremely dissatisfied,Proin odio justo neque sagittis blandit pharetra. Pharetra interdum! Erat ligula.
personal,94,Austin,Government Services,Extremely dissatisfied,Placerat quam consequat! Placerat nullam rhoncus nullam turpis nullam dui nulla. Pede ridiculus auctor.
personal,69,Fort Worth,Consulting,Extremely satisfied,Mattis duis ultrices? Porttitor ac quam lorem suspendisse velit odio quam atque platea ligula morbi.
personal,58,San Antonio,Energy,Somewhat satisfied,Placerat bibendum laoreet! Tempus molestie dolor ultricies! Fusce purus consequat lectus elit laoreet per.
personal,81,Dallas,Technology,Somewhat dissatisfied,"Iaculis orci? Vulputate risus bibendum nunc praesent! Integer, dapibus in."
personal,46,Dallas,Technology,Extremely satisfied,Pretium gravida? Lorem dolor. Nonummy a porttitor wisi? Ab quam tincidunt.
personal,19,Austin,Healthcare,Extremely satisfied,Fermentum tortor integer. Imperdiet tortor. Porta et odio duis viverra.
personal,33,Austin,Government Services,Extremely satisfied,Diam elementum facilisis ante vitae cursus odio? Posuere dignissim purus.
personal,88,San Antonio,Consulting,Somewhat satisfied,Risus ullamcorper est tempus id dapibus id rhoncus faucibus potenti? Iaculis augue. Accumsan? Quis.
personal,70,Fort Worth,Healthcare,Extremely satisfied,Quam? Tempora maecenas! Odio temporibus iaculis! Sem sodales! Vitae integer quam accumsan.
personal,64,Fort Worth,Energy,Somewhat dissatisfied,Duis rhoncus suspendisse aenean maecenas faucibus. In? Euismod malesuada facilisis sagittis blandit.
personal,66,Austin,Energy,Somewhat dissatisfied,Tempor risus dapibus primis vehicula facilisis porta orci mi facilisis aliquam! Massa porttitor nulla vivamus.
personal,91,Dallas,Energy,Extremely satisfied,Sodales iaculis primis leo. Lectus elit ridiculus vitae. Dignissim augue suspendisse.
personal,34,Fort Worth,Consulting,Neither satisfied nor dissatisfied,"Nibh malesuada. Pretium viverra platea fusce a maecenas, per etiam viverra primis."
personal,54,Houston,Technology,Extremely satisfied,Et pharetra rhoncus magna wisi leo egestas imperdiet scelerisque integer sed proin venenatis aliquam.
personal,74,Austin,Consulting,Extremely dissatisfied,"Erat urna lacus ultricies eget praesent, elementum ultricies ultrices nibh. Dictumst temporibus nullam egestas cursus."
personal,24,San Antonio,Consulting,Extremely dissatisfied,Justo sagittis ultricies risus aliquet ipsum? Gravida sit! Elementum erat pharetra aliquam odio vivamus.
personal,84,Houston,Technology,Neither satisfied nor dissatisfied,Non? Magna! Consequat sodales bibendum. Massa porta! Ultricies temporibus potenti. Luctus arcu.
personal,27,Dallas,Government Services,Somewhat dissatisfied,Placerat aliquam eu nunc mattis. Urna dolor nunc lectus tempus! Nonummy.
personal,67,San Antonio,Energy,Somewhat satisfied,Vehicula sodales vehicula sagittis natoque nullam! Mi donec porttitor ipsum magna aenean? Rutrum dignissim interdum.
personal,22,Houston,Consulting,Somewhat dissatisfied,"Augue porta eu nulla fermentum? Ab placerat, sapien ridiculus sem! Egestas lectus interdum."
personal,47,Dallas,Government Services,Somewhat dissatisfied,"Non fringilla a egestas! Faucibus! Morbi, at curabitur tempus etiam. Duis, ab, cras elementum proin."
personal,94,San Antonio,Consulting,Neither satisfied nor dissatisfied,"Suspendisse montes pellentesque. Diam magna elementum rhoncus, quam lacus risus."
